award_year,category,name1,name2,name3,film_title,character_name,film_title2,character_name2,film_title3,character_name3,film_title4,character_name4,honorary_statement,description,note
1989 (62nd),DIRECTING,Oliver Stone,,,Born on the Fourth of July,,,,,,,,,,
1957 (30th),MUSIC (Scoring),Malcolm Arnold,,,The Bridge on the River Kwai,,,,,,,,,,
1992 (65th),VISUAL EFFECTS,"Ken Ralston, Doug Chiang, Doug Smythe, Tom Woodruff, Jr.",,,Death Becomes Her,,,,,,,,,,
2001 (74th),SHORT FILM (Live Action),"Ray McKinnon, Lisa Blount",,,the accountant,,,,,,,,,,
2014 (87th),ACTOR IN A SUPPORTING ROLE,J.K. Simmons,,,Whiplash,"{""Fletcher""}",,,,,,,,,
1993 (66th),ACTOR IN A SUPPORTING ROLE,Tommy Lee Jones,,,The Fugitive,"{""Samuel Gerard""}",,,,,,,,,
1976 (49th),ACTRESS IN A LEADING ROLE,Faye Dunaway,,,Network,"{""Diana Christensen""}",,,,,,,,,
1953 (26th),IRVING G. THALBERG MEMORIAL AWARD,George Stevens,,,,,,,,,,,,,
1941 (14th),ACTOR IN A SUPPORTING ROLE,Donald Crisp,,,How Green Was My Valley,"{""Mr. Morgan""}",,,,,,,,,
1959 (32nd),ACTRESS IN A SUPPORTING ROLE,Shelley Winters,,,The Diary of Anne Frank,"{""Mrs. Van Daan""}",,,,,,,,,
2017 (90th),SOUND MIXING,"Gregg Landaker, Gary A. Rizzo and Mark Weingarten",,,Dunkirk,,,,,,,,,,
2009 (82nd),ACTRESS IN A SUPPORTING ROLE,Mo'Nique,,,Precious: Based on the Novel 'Push' by Sapphire,"{""Mary""}",,,,,,,,,
1934 (7th),FILM EDITING,Conrad Nervig,,,Eskimo,,,,,,,,,,
1960 (33rd),FOREIGN LANGUAGE FILM,Sweden,,,The Virgin Spring,,,,,,,,,,
1964 (37th),DOCUMENTARY (Short Subject),"Charles Guggenheim, Producer",,,Nine from Little Rock,,,,,,,,,,
1966 (39th),MUSIC (Song),Music by John Barry; Lyrics by Don Black,,,Born Free,,,,,,,,,,
2012 (85th),SCIENTIFIC AND TECHNICAL AWARD (Technical Achievement Award),,,,,,,,,,,,"To J.P. LEWIS, MATT CORDNER and NICKSON FONG for the invention and publication of the Pose Space Deformation technique.",Pose Space Deformation (PSD) introduced the use of novel sparse data interpolation techniques to the task of shape interpolation. The controllability and ease of achieving artistic intent have led to PSD being a foundational technique in the creation of computer-generated characters.,
2015 (88th),ACTOR IN A LEADING ROLE,Leonardo DiCaprio,,,The Revenant,"{""Hugh Glass""}",,,,,,,,,
1973 (46th),MUSIC (Song),Music by Marvin Hamlisch; Lyrics by Alan Bergman and Marilyn Bergman,,,The Way We Were,,,,,,,,,,
1945 (18th),CINEMATOGRAPHY (Color),Leon Shamroy,,,Leave Her to Heaven,,,,,,,,,,
1932/33 (6th),WRITING (Original Story),Robert Lord,,,One Way Passage,,,,,,,,,,
2013 (86th),JOHN A. BONNER MEDAL OF COMMENDATION,,,,,,,,,,,,"To Charles ""Tad"" Marburg in appreciation for outstanding service and dedication in upholding the high standards of the Academy of Motion Picture Arts and Sciences.",,
1972 (45th),SOUND,"Robert Knudson, David Hildyard",,,Cabaret,,,,,,,,,,
2012 (85th),COSTUME DESIGN,Jacqueline Durran,,,Anna Karenina,,,,,,,,,,
1996 (69th),SCIENTIFIC AND TECHNICAL AWARD (Technical Achievement Award),,,,,,,,,,,,"To PERRY KIVOLOWITZ, for the primary design, and DR. GARTH A. DICKIE for the development of the algorithms, for the shape-driven warping and morphing subsystem of the Elastic Reality Special Effects System.",,
1977 (50th),SCIENTIFIC OR TECHNICAL AWARD (Class I),,,,,,,,,,,,"To GARRETT BROWN and the CINEMA PRODUCTS CORPORATION ENGINEERING STAFF under the supervision of John Jurgens, for the invention and development of Steadicam.",,
1983 (56th),SHORT FILM (Animated),"Jimmy Picker, Producer",,,Sundae in New York,,,,,,,,,,
1941 (14th),CINEMATOGRAPHY (Color),"Ernest Palmer, Ray Rennahan",,,Blood and Sand,,,,,,,,,,
2021 (94th),ACTOR IN A SUPPORTING ROLE,Troy Kotsur,,,CODA,"{""Frank Rossi""}",,,,,,,,,
1996 (69th),DIRECTING,Anthony Minghella,,,The English Patient,,,,,,,,,,
2011 (84th),FOREIGN LANGUAGE FILM,Iran,,,A Separation,,,,,,,,,,
2016 (89th),FOREIGN LANGUAGE FILM,Iran,,,The Salesman,,,,,,,,,,
2001 (74th),SCIENTIFIC AND TECHNICAL AWARD (Scientific and Engineering Award),,,,,,,,,,,,"To JOHN M. EARGLE, D.B. ""DON"" KEELE and MARK E. ENGEBRETSON for the concept, design and engineering of the modern constant-directivity, direct radiator style motion picture loudspeaker systems.","The work of John M. Eargle, D.B. ""Don"" Keele and Mark E. Engebretson has resulted in the over 20-year dominance of constant-directivity, direct radiator bass style cinema loudspeaker systems.",
1952 (25th),CINEMATOGRAPHY (Color),"Winton C. Hoch, Archie Stout",,,The Quiet Man,,,,,,,,,,
2021 (94th),MUSIC (Original Score),Hans Zimmer,,,Dune,,,,,,,,,,
1980 (53rd),WRITING (Screenplay Based on Material from Another Medium),Alvin Sargent,,,Ordinary People,,,,,,,,,,
2021 (94th),ACTOR IN A LEADING ROLE,Will Smith,,,King Richard,"{""Richard Williams""}",,,,,,,,,
1986 (59th),BEST PICTURE,"Arnold Kopelson, Producer",,,Platoon,,,,,,,,,,
1991 (64th),FOREIGN LANGUAGE FILM,Italy,,,Mediterraneo,,,,,,,,,,
1967 (40th),SHORT SUBJECT (Cartoon),"Fred Wolf, Producer",,,The Box,,,,,,,,,,
1997 (70th),VISUAL EFFECTS,"Robert Legato, Mark Lasoff, Thomas L. Fisher, Michael Kanfer",,,Titanic,,,,,,,,,,
2007 (80th),SHORT FILM (Live Action),Philippe Pollet-Villard,,,Le Mozart des Pickpockets (The Mozart of Pickpockets),,,,,,,,,,
1951 (24th),MUSIC (Song),Music by Hoagy Carmichael; Lyrics by Johnny Mercer,,,Here Comes the Groom,,,,,,,,,,
2000 (73rd),DOCUMENTARY (Short Subject),Tracy Seretean,,,Big Mama,,,,,,,,,,
1966 (39th),FOREIGN LANGUAGE FILM,France,,,A Man and a Woman,,,,,,,,,,
2006 (79th),COSTUME DESIGN,Milena Canonero,,,Marie Antoinette,,,,,,,,,,
1989 (62nd),MAKEUP,"Manlio Rocchetti, Lynn Barber, Kevin Haney",,,Driving Miss Daisy,,,,,,,,,,
2017 (90th),WRITING (Original Screenplay),Written by Jordan Peele,,,Get Out,,,,,,,,,,
1946 (19th),MUSIC (Song),Music by Harry Warren; Lyrics by Johnny Mercer,,,The Harvey Girls,,,,,,,,,,
1977 (50th),SHORT FILM (Live Action),"Beverly Shaffer and Yuki Yoshida, Producers",,,I'll Find a Way,,,,,,,,,,
1946 (19th),SOUND RECORDING,"Columbia Studio Sound Department, John Livadary, Sound Director",,,The Jolson Story,,,,,,,,,,
1999 (72nd),ART DIRECTION,Art Direction:  Rick Heinrichs;  Set Decoration:  Peter Young,,,Sleepy Hollow,,,,,,,,,,
1988 (61st),ACTRESS IN A LEADING ROLE,Jodie Foster,,,The Accused,"{""Sarah Tobias""}",,,,,,,,,
1937 (10th),DANCE DIRECTION,Hermes Pan,,,A Damsel in Distress,,,,,,,,,,
2009 (82nd),DIRECTING,Kathryn Bigelow,,,The Hurt Locker,,,,,,,,,,
2005 (78th),WRITING (Original Screenplay),Screenplay by Paul Haggis & Bobby Moresco; Story by Paul Haggis,,,Crash,,,,,,,,,,
1940 (13th),ART DIRECTION (Black-and-White),"Cedric Gibbons, Paul Groesse",,,Pride and Prejudice,,,,,,,,,,
1959 (32nd),HONORARY AWARD,,,,,,,,,,,,To Lee De Forest for his pioneering inventions which brought sound to the motion picture.,,
1958 (31st),WRITING (Story and Screenplay--written directly for the screen),"Nedrick Young, Harold Jacob Smith",,,The Defiant Ones,,,,,,,,,,"[NOTE: Upon request of his widow and upon recommendation of the Writers Branch Executive Committee, the Board of Governors voted on June 22, 1993, to restore the name of Nedrick Young to the nominations and award presented to Nathan E. Douglas (Mr. Young's pseudonym during the blacklisting period).]"
1965 (38th),ART DIRECTION (Black-and-White),Art Direction:  Robert Clatworthy;  Set Decoration:  Joseph Kish,,,Ship of Fools,,,,,,,,,,
1939 (12th),SPECIAL EFFECTS,"Fred Sersen, E. H. Hansen",,,The Rains Came,,,,,,,,,,
1929/30 (3rd),DIRECTING,Lewis Milestone,,,All Quiet on the Western Front,,,,,,,,,,
1976 (49th),MUSIC (Original Song Score and Its Adaptation or Adaptation Score),Adaptation Score by Leonard Rosenman,,,Bound for Glory,,,,,,,,,,
1963 (36th),IRVING G. THALBERG MEMORIAL AWARD,Sam Spiegel,,,,,,,,,,,,,
1937 (10th),IRVING G. THALBERG MEMORIAL AWARD,Darryl F. Zanuck,,,,,,,,,,,,,
1945 (18th),DIRECTING,Billy Wilder,,,The Lost Weekend,,,,,,,,,,
1995 (68th),MUSIC (Original Dramatic Score),Luis Enrique Bacalov,,,The Postman (Il Postino),,,,,,,,,,
1940 (13th),CINEMATOGRAPHY (Black-and-White),George Barnes,,,Rebecca,,,,,,,,,,
1976 (49th),SCIENTIFIC OR TECHNICAL AWARD (Class III),,,,,,,,,,,,To FRED BARTSCHER of Kollmorgen Corporation and to GLENN BERGGREN of the Schneider Corporation for the design and development of a single-lens magnifier for motion picture projection lenses.,,
2013 (86th),PRODUCTION DESIGN,Production Design: Catherine Martin; Set Decoration: Beverley Dunn,,,The Great Gatsby,,,,,,,,,,
1947 (20th),SHORT SUBJECT (One-reel),"Herbert Moulton, Producer",,,Good-bye Miss Turlock,,,,,,,,,,
2007 (80th),WRITING (Original Screenplay),Written by Diablo Cody,,,Juno,,,,,,,,,,
2005 (78th),FILM EDITING,Hughes Winborne,,,Crash,,,,,,,,,,
2018 (91st),ACTRESS IN A LEADING ROLE,Olivia Colman,,,The Favourite,"{""Queen Anne""}",,,,,,,,,
2005 (78th),ACTOR IN A SUPPORTING ROLE,George Clooney,,,Syriana,"{""Bob Barnes""}",,,,,,,,,
1982 (55th),BEST PICTURE,"Richard Attenborough, Producer",,,Gandhi,,,,,,,,,,
1992 (65th),SOUND,"Chris Jenkins, Doug Hemphill, Mark Smith, Simon Kaye",,,The Last of the Mohicans,,,,,,,,,,
1945 (18th),WRITING (Original Motion Picture Story),Charles G. Booth,,,The House on 92nd Street,,,,,,,,,,
2016 (89th),ACTRESS IN A LEADING ROLE,Emma Stone,,,La La Land,"{""Mia""}",,,,,,,,,
1941 (14th),SHORT SUBJECT (Cartoon),"Walt Disney, Producer",,,Lend a Paw,,,,,,,,,,
2002 (75th),HONORARY AWARD,,,,,,,,,,,,"To Peter O'Toole, whose remarkable talents have provided cinema history with some of its most memorable characters.",,
1974 (47th),SCIENTIFIC OR TECHNICAL AWARD (Class III),,,,,,,,,,,,"To THE ELEMACK COMPANY, ROME, ITALY, for the design and development of their Spyder camera dolly.",,
1930/31 (4th),ART DIRECTION,Max Rée,,,Cimarron,,,,,,,,,,
1962 (35th),MUSIC (Song),Music by Henry Mancini; Lyrics by Johnny Mercer,,,Days of Wine and Roses,,,,,,,,,,
1996 (69th),HONORARY AWARD,,,,,,,,,,,,To Michael Kidd in recognition of his services to the art of the dance in the art of the screen.,,
1943 (16th),SCIENTIFIC OR TECHNICAL AWARD (Class II),,,,,,,,,,,,"To FARCIOT EDOUART, EARLE MORGAN, BARTON THOMPSON and the PARAMOUNT STUDIO ENGINEERING and TRANSPARENCY DEPARTMENTS for the development and practical application to motion picture production of a method of duplicating and enlarging natural color photographs, transferring the image emulsions to glass plates and projecting these slides by especially designed stereopticon equipment.",,
1953 (26th),FILM EDITING,William Lyon,,,From Here to Eternity,,,,,,,,,,
1997 (70th),ACTOR IN A LEADING ROLE,Jack Nicholson,,,As Good as It Gets,"{""Melvin Udall""}",,,,,,,,,
2004 (77th),SCIENTIFIC AND TECHNICAL AWARD (Academy Award of Merit),,,,,,,,,,,,To HORST BURBULLA for the invention and continuing development of the Technocrane telescoping camera crane.,"With its electronically driven leveling head, adjustable moveable weight carriage, and lightweight, extremely precise telescoping beam elements that allow camera movement during shots, the Technocrane has redefined the state-of-the-art in camera crane technology.",
1994 (67th),SCIENTIFIC AND TECHNICAL AWARD (Technical Achievement Award),,,,,,,,,,,,"To B. RUSSELL HESSEY of Special Effects Spectacular, Inc. and VINCENT T. KELTON for the hardware design and GEORGE JACKMAN of De La Mare Engineering, Inc. for the pyrotechnic development which together comprise the non-gun safety blank firing system.",,
1955 (28th),SPECIAL EFFECTS,Paramount Studio,,,The Bridges at Toko-Ri,,,,,,,,,,
1989 (62nd),ACTOR IN A LEADING ROLE,Daniel Day Lewis,,,My Left Foot,"{""Christy Brown""}",,,,,,,,,
2010 (83rd),FOREIGN LANGUAGE FILM,Denmark,,,In a Better World,,,,,,,,,,
1987 (60th),SCIENTIFIC OR TECHNICAL AWARD (Academy Award of Merit),,,,,,,,,,,,To BERNHARD KÜHL and WERNER BLOCK and to the OSRAM GmbH RESEARCH AND DEVELOPMENT DEPARTMENT for the invention and the continuing improvement of the OSRAM HMI light source for motion picture photography.,,
2016 (89th),ANIMATED FEATURE FILM,"Byron Howard, Rich Moore and Clark Spencer",,,Zootopia,,,,,,,,,,
1979 (52nd),ACTOR IN A LEADING ROLE,Dustin Hoffman,,,Kramer vs. Kramer,"{""Ted Kramer""}",,,,,,,,,
1930/31 (4th),DIRECTING,Norman Taurog,,,Skippy,,,,,,,,,,
1981 (54th),ACTRESS IN A LEADING ROLE,Katharine Hepburn,,,On Golden Pond,"{""Ethel Thayer""}",,,,,,,,,
1940 (13th),MUSIC (Song),Music by Leigh Harline; Lyrics by Ned Washington,,,Pinocchio,,,,,,,,,,
1997 (70th),CINEMATOGRAPHY,Russell Carpenter,,,Titanic,,,,,,,,,,
1990 (63rd),SCIENTIFIC OR TECHNICAL AWARD (Technical Achievement Award),,,,,,,,,,,,"To WILLIAM L. BLOWERS of Belco Associates, Incorporated and THOMAS F. DENOVE for the development and manufacture of the Belco/Denove Cinemeter.  This digital/analog exposure meter was specifically and uniquely designed for the cinematographer.",,
1949 (22nd),ACTRESS,Olivia de Havilland,,,The Heiress,"{""Catherine Sloper""}",,,,,,,,,
1944 (17th),ART DIRECTION (Color),Art Direction:  Wiard Ihnen;  Interior Decoration:  Thomas Little,,,Wilson,,,,,,,,,,
1939 (12th),WRITING (Screenplay),Sidney Howard,,,Gone with the Wind,,,,,,,,,,
1986 (59th),IRVING G. THALBERG MEMORIAL AWARD,Steven Spielberg,,,,,,,,,,,,,
2008 (81st),ACTOR IN A LEADING ROLE,Sean Penn,,,Milk,"{""Harvey Milk""}",,,,,,,,,
2007 (80th),AWARD OF COMMENDATION,,,,,,,,,,,,To Jonathan Erland in recognition of his leadership and efforts toward identifying and solving the problem of High-Speed Emulsion Stress Syndrome in motion picture film stock.,"By coordinating and conducting tests for and with the industry, and by sharing results openly, Mr. Erland clearly demonstrated the value and effectiveness of independent research and industry-wide cooperation.",
1969 (42nd),SCIENTIFIC OR TECHNICAL AWARD (Class III),,,,,,,,,,,,"To OTTO POPELKA of Magna-Tech Electronics Company, Inc., for the development of an Electronically Controlled Looping System.",,
1935 (8th),SHORT SUBJECT (Novelty),Gaumont British and Skibo Productions,,,Wings over Mt. Everest,,,,,,,,,,
1982 (55th),ACTRESS IN A SUPPORTING ROLE,Jessica Lange,,,Tootsie,"{""Julie Nichols""}",,,,,,,,,
2000 (73rd),AWARD OF COMMENDATION,,,,,,,,,,,,"To Ioan Allen for the concept, Robin Bransbury for the design and Mark Harrah for the implementation of the Trailer Audio Standards Association (TASA) Loudness Standard.",The adoption of the TASA loudness standard has led directly to better sound in the cinema for trailers and features alike.,
2022 (95th),SHORT FILM (Live Action),Tom Berkeley and Ross White,,,An Irish Goodbye,,,,,,,,,,
1947 (20th),MUSIC (Scoring of a Musical Picture),Alfred Newman,,,Mother Wore Tights,,,,,,,,,,
1999 (72nd),SHORT FILM (Animated),Alexander Petrov,,,The Old Man and the Sea,,,,,,,,,,
1995 (68th),ACTRESS IN A SUPPORTING ROLE,Mira Sorvino,,,Mighty Aphrodite,"{""Linda""}",,,,,,,,,
1990 (63rd),DIRECTING,Kevin Costner,,,Dances With Wolves,,,,,,,,,,
1995 (68th),WRITING (Screenplay Written Directly for the Screen),Christopher McQuarrie,,,The Usual Suspects,,,,,,,,,,
2022 (95th),MAKEUP AND HAIRSTYLING,"Adrien Morot, Judy Chin and Annemarie Bradley",,,The Whale,,,,,,,,,,
2009 (82nd),SCIENTIFIC AND TECHNICAL AWARD (Technical Achievement Award),,,,,,,,,,,,To MARK WOLFORTH and TONY SEDIVY for their contributions to the development of the Truelight real-time 3D look-up table hardware system.,"Through the use of color management software and hardware, this complete system enables accurate color presentation in the digital intermediate preview process. The Truelight system is widely utilized in digital intermediate production environments around the world.",
1965 (38th),ACTOR IN A SUPPORTING ROLE,Martin Balsam,,,A Thousand Clowns,"{""Arnold Burns""}",,,,,,,,,
2003 (76th),MAKEUP,Richard Taylor and Peter King,,,The Lord of the Rings: The Return of the King,,,,,,,,,,
1956 (29th),SCIENTIFIC OR TECHNICAL AWARD (Class III),,,,,,,,,,,,"To RICHARD H. RANGER of Rangertone, Inc., for the development of a synchronous recording and reproducing system for quarter-inch magnetic tape.",,
1944 (17th),ACTRESS IN A SUPPORTING ROLE,Ethel Barrymore,,,None but the Lonely Heart,"{""Ma Mott""}",,,,,,,,,
2002 (75th),CINEMATOGRAPHY,Conrad L. Hall,,,Road to Perdition,,,,,,,,,,
1979 (52nd),SCIENTIFIC OR TECHNICAL AWARD (Academy Award of Merit),,,,,,,,,,,,"To MARK SERRURIER for the progressive development of the Moviola from the 1924 invention of his father, Iwan Serrurier, to the present Series 20 sophisticated film editing equipment.",,
1942 (15th),MUSIC (Music Score of a Dramatic or Comedy Picture),Max Steiner,,,"Now, Voyager",,,,,,,,,,
1961 (34th),WRITING (Screenplay--based on material from another medium),Abby Mann,,,Judgment at Nuremberg,,,,,,,,,,
2013 (86th),GORDON E. SAWYER AWARD,,,,,,,,,,,,Peter W. Anderson,,
1993 (66th),MUSIC (Original Score),John Williams,,,Schindler's List,,,,,,,,,,
1953 (26th),SOUND RECORDING,"Columbia Studio Sound Department, John P. Livadary, Sound Director",,,From Here to Eternity,,,,,,,,,,
1957 (30th),CINEMATOGRAPHY,Jack Hildyard,,,The Bridge on the River Kwai,,,,,,,,,,
1961 (34th),DOCUMENTARY (Short Subject),"Frank P. Bibas, Producer",,,Project Hope,,,,,,,,,,
2015 (88th),MAKEUP AND HAIRSTYLING,"Lesley Vanderwalt, Elka Wardega and Damian Martin",,,Mad Max: Fury Road,,,,,,,,,,
1938 (11th),ACTOR IN A SUPPORTING ROLE,Walter Brennan,,,Kentucky,"{""Peter Goodwin""}",,,,,,,,,
1958 (31st),SOUND,"Todd-AO Sound Department, Fred Hynes, Sound Director",,,South Pacific,,,,,,,,,,
1968 (41st),MUSIC (Score of a Musical Picture--original or adaptation),Adaptation score by John Green,,,Oliver!,,,,,,,,,,
2002 (75th),DOCUMENTARY (Short Subject),"Bill Guttentag, Robert David Port",,,Twin Towers,,,,,,,,,,
1952 (25th),SCIENTIFIC OR TECHNICAL AWARD (Class I),,,,,,,,,,,,To EASTMAN KODAK COMPANY for the introduction of Eastman color negative and Eastman color print film.,,
1943 (16th),SHORT SUBJECT (One-reel),"Grantland Rice, Producer",,,Amphibious Fighters,,,,,,,,,,
1962 (35th),WRITING (Screenplay--based on material from another medium),Horton Foote,,,To Kill a Mockingbird,,,,,,,,,,
2011 (84th),JOHN A. BONNER MEDAL OF COMMENDATION,,,,,,,,,,,,To Jonathan Erland in appreciation for outstanding service and dedication in upholding the high standards of the Academy of Motion Picture Arts and Sciences.,,
1957 (30th),BEST MOTION PICTURE,"Sam Spiegel, Producer",,,The Bridge on the River Kwai,,,,,,,,,,
1969 (42nd),ART DIRECTION,"Art Direction:  John DeCuir, Jack Martin Smith, Herman Blumenthal;  Set Decoration:  Walter M. Scott, George Hopkins, Raphael Bretton",,,"Hello, Dolly!",,,,,,,,,,
2013 (86th),JEAN HERSHOLT HUMANITARIAN AWARD,Angelina Jolie,,,,,,,,,,,,,
1960 (33rd),ART DIRECTION (Black-and-White),Art Direction:  Alexander Trauner;  Set Decoration:  Edward G. Boyle,,,The Apartment,,,,,,,,,,
1992 (65th),SOUND EFFECTS EDITING,"Tom C. McCarthy, David E. Stone",,,Bram Stoker's Dracula,,,,,,,,,,
2010 (83rd),BEST PICTURE,"Iain Canning, Emile Sherman and Gareth Unwin, Producers",,,The King's Speech,,,,,,,,,,
1987 (60th),FOREIGN LANGUAGE FILM,Denmark,,,Babette's Feast,,,,,,,,,,
1988 (61st),CINEMATOGRAPHY,Peter Biziou,,,Mississippi Burning,,,,,,,,,,
1936 (9th),WRITING (Screenplay),"Pierre Collings, Sheridan Gibney",,,The Story of Louis Pasteur,,,,,,,,,,
1955 (28th),SOUND RECORDING,"Todd-AO Sound Department, Fred Hynes, Sound Director",,,Oklahoma!,,,,,,,,,,
2001 (74th),DOCUMENTARY (Feature),"Jean-Xavier de Lestrade, Denis Poncet",,,Murder on a Sunday Morning,,,,,,,,,,
1996 (69th),DOCUMENTARY (Short Subject),Jessica Yu,,,Breathing Lessons: The Life and Work of Mark O'Brien,,,,,,,,,,
1953 (26th),SCIENTIFIC OR TECHNICAL AWARD (Class III),,,,,,,,,,,,To WESTREX CORPORATION for the design and construction of a new film editing machine.,,
1968 (41st),WRITING (Screenplay--based on material from another medium),James Goldman,,,The Lion in Winter,,,,,,,,,,
1934 (7th),ACTRESS,Claudette Colbert,,,It Happened One Night,"{""Ellie Andrews""}",,,,,,,,,
1955 (28th),WRITING (Motion Picture Story),Daniel Fuchs,,,Love Me or Leave Me,,,,,,,,,,
2014 (87th),ACTOR IN A LEADING ROLE,Eddie Redmayne,,,The Theory of Everything,"{""Stephen Hawking""}",,,,,,,,,
1992 (65th),JEAN HERSHOLT HUMANITARIAN AWARD,Audrey Hepburn,Elizabeth Taylor,,,,,,,,,,,,"[NOTE: The Academy's Board of Governors voted to confer this award on January 12, 1993.  Ms. Hepburn passed away on January 20th, and the award was accepted on her behalf by her son, Sean Hepburn Ferrer.]"
1935 (8th),ACTRESS,Bette Davis,,,Dangerous,"{""Joyce Heath""}",,,,,,,,,
1992 (65th),HONORARY AWARD,,,,,,,,,,,,To Federico Fellini in recognition of his place as one of the screen's master storytellers.,,
2004 (77th),MAKEUP,Valli O'Reilly and Bill Corso,,,Lemony Snicket's A Series of Unfortunate Events,,,,,,,,,,
1931/32 (5th),WRITING (Original Story),Frances Marion,,,The Champ,,,,,,,,,,
1994 (67th),ACTRESS IN A SUPPORTING ROLE,Dianne Wiest,,,Bullets over Broadway,"{""Helen Sinclair""}",,,,,,,,,
1980 (53rd),SHORT FILM (Animated),"Ferenc Rofusz, Producer",,,The Fly,,,,,,,,,,
2011 (84th),GORDON E. SAWYER AWARD,,,,,,,,,,,,Douglas Trumbull,,
1931/32 (5th),SCIENTIFIC OR TECHNICAL AWARD (Class II),,,,,,,,,,,,To TECHNICOLOR MOTION PICTURE CORP. for its color cartoon process.,,
2017 (90th),HONORARY AWARD,,,,,,,,,,,,"To Charles Burnett, a resolutely independent and influential film pioneer who has chronicled the lives of black Americans with eloquence and insight.",,
1967 (40th),SOUND EFFECTS,John Poyner,,,The Dirty Dozen,,,,,,,,,,
1994 (67th),WRITING (Screenplay Based on Material Previously Produced or Published),Eric Roth,,,Forrest Gump,,,,,,,,,,
2017 (90th),MUSIC (Original Score),Alexandre Desplat,,,The Shape of Water,,,,,,,,,,
2021 (94th),SOUND,"Mac Ruth, Mark Mangini, Theo Green, Doug Hemphill and Ron Bartlett",,,Dune,,,,,,,,,,
2021 (94th),VISUAL EFFECTS,"Paul Lambert, Tristan Myles, Brian Connor and Gerd Nefzer",,,Dune,,,,,,,,,,
1996 (69th),VISUAL EFFECTS,"Volker Engel, Douglas Smith, Clay Pinney, Joseph Viskocil",,,Independence Day,,,,,,,,,,
1982 (55th),HONORARY AWARD,,,,,,,,,,,,"To Mickey Rooney, in recognition of his 60 years of versatility in a variety of memorable film performances.",,
1994 (67th),FOREIGN LANGUAGE FILM,Russia,,,Burnt by the Sun,,,,,,,,,,
1958 (31st),SCIENTIFIC OR TECHNICAL AWARD (Class III),,,,,,,,,,,,"To WILLY BORBERG of the General Precision Laboratory, Inc., for the development of a high speed intermittent movement for 35mm motion picture theatre projection equipment.",,
1940 (13th),ACTOR IN A SUPPORTING ROLE,Walter Brennan,,,The Westerner,"{""Judge Roy Bean""}",,,,,,,,,
1951 (24th),ACTOR,Humphrey Bogart,,,The African Queen,"{""Charlie Allnut""}",,,,,,,,,
1991 (64th),SOUND EFFECTS EDITING,"Gary Rydstrom, Gloria S. Borders",,,Terminator 2: Judgment Day,,,,,,,,,,
1952 (25th),ACTOR,Gary Cooper,,,High Noon,"{""Will Kane""}",,,,,,,,,
1993 (66th),DOCUMENTARY (Feature),"Susan Raymond, Alan Raymond",,,I Am a Promise: The Children of Stanton Elementary School,,,,,,,,,,
1939 (12th),FILM EDITING,"Hal C. Kern, James E. Newcom",,,Gone with the Wind,,,,,,,,,,
1959 (32nd),CINEMATOGRAPHY (Black-and-White),William C. Mellor,,,The Diary of Anne Frank,,,,,,,,,,
1978 (51st),ACTOR IN A LEADING ROLE,Jon Voight,,,Coming Home,"{""Luke Martin""}",,,,,,,,,
1935 (8th),SHORT SUBJECT (Cartoon),"Walt Disney, Producer",,,Three Orphan Kittens,,,,,,,,,,
1940 (13th),SHORT SUBJECT (Two-reel),Warner Bros.,,,"Teddy, the Rough Rider",,,,,,,,,,
1955 (28th),SCIENTIFIC OR TECHNICAL AWARD (Class III),,,,,,,,,,,,To 20TH CENTURY-FOX STUDIO and the BAUSCH & LOMB CO. for the new combination lenses for CinemaScope Photography.,,
1961 (34th),MUSIC (Song),Music by Henry Mancini; Lyrics by Johnny Mercer,,,Breakfast at Tiffany's,,,,,,,,,,
1961 (34th),FILM EDITING,Thomas Stanford,,,West Side Story,,,,,,,,,,
2001 (74th),MAKEUP,"Peter Owen, Richard Taylor",,,The Lord of the Rings: The Fellowship of the Ring,,,,,,,,,,
1935 (8th),MUSIC (Scoring),"RKO Radio Studio Music Department, Max Steiner, head of department  (Score by Max Steiner)",,,The Informer,,,,,,,,,,
1997 (70th),SCIENTIFIC AND TECHNICAL AWARD (Academy Award of Merit),,,,,,,,,,,,"To GUNNAR P. MICHELSON for the engineering and development of an improved, electronic, high-speed, precision light valve for use in motion picture printing machines.",,
1955 (28th),FILM EDITING,"Charles Nelson, William A. Lyon",,,Picnic,,,,,,,,,,
2001 (74th),ART DIRECTION,Art Direction:  Catherine Martin; Set Decoration:  Brigitte Broch,,,Moulin Rouge,,,,,,,,,,
1940 (13th),SOUND RECORDING,"Metro-Goldwyn-Mayer Studio Sound Department, Douglas Shearer, Sound Director",,,Strike Up the Band,,,,,,,,,,
2003 (76th),SHORT FILM (Animated),Adam Elliot,,,Harvie Krumpet,,,,,,,,,,
2001 (74th),COSTUME DESIGN,"Catherine Martin, Angus Strathie",,,Moulin Rouge,,,,,,,,,,
1985 (58th),JEAN HERSHOLT HUMANITARIAN AWARD,Charles 'Buddy' Rogers,,,,,,,,,,,,,
2002 (75th),DOCUMENTARY (Feature),"Michael Moore, Michael Donovan",,,Bowling for Columbine,,,,,,,,,,
1983 (56th),WRITING (Screenplay Written Directly for the Screen),Horton Foote,,,Tender Mercies,,,,,,,,,,
1978 (51st),SPECIAL ACHIEVEMENT AWARD (Visual Effects),"Les Bowie, Colin Chilvers, Denys Coop, Roy Field, Derek Meddings, Zoran Perisic",,,Superman,,,,,,,,,,
1954 (27th),COSTUME DESIGN (Color),Sanzo Wada,,,Gate of Hell,,,,,,,,,,
2015 (88th),CINEMATOGRAPHY,Emmanuel Lubezki,,,The Revenant,,,,,,,,,,
1981 (54th),SCIENTIFIC OR TECHNICAL AWARD (Technical Achievement Award),,,,,,,,,,,,To HAL LANDAKER for the concept and to ALAN D. LANDAKER for the engineering of the Burbank Studios' Production Sound Department 24-frame color video system.,,
1970 (43rd),SHORT SUBJECT (Cartoon),"Nick Bosustow, Producer",,,Is It Always Right to Be Right?,,,,,,,,,,
2011 (84th),BEST PICTURE,"Thomas Langmann, Producer",,,The Artist,,,,,,,,,,
1993 (66th),CINEMATOGRAPHY,Janusz Kaminski,,,Schindler's List,,,,,,,,,,
1931/32 (5th),SOUND RECORDING,Paramount Publix Studio Sound Department,,,,,,,,,,,,,[NOTE: This award was not associated with any specific film title.]
1965 (38th),SOUND EFFECTS,Tregoweth Brown,,,The Great Race,,,,,,,,,,
