award_year,category,name1,name2,name3,film_title,character_name,film_title2,character_name2,film_title3,character_name3,film_title4,character_name4,honorary_statement,description,note
2017 (90th),ACTRESS IN A SUPPORTING ROLE,Allison Janney,,,"I, Tonya","{""LaVona""}",,,,,,,,,
1951 (24th),COSTUME DESIGN (Black-and-White),Edith Head,,,A Place in the Sun,,,,,,,,,,
2014 (87th),SHORT FILM (Live Action),Mat Kirkby and James Lucas,,,The Phone Call,,,,,,,,,,
2012 (85th),SCIENTIFIC AND TECHNICAL AWARD (Scientific and Engineering Award),,,,,,,,,,,,"To SIMON CLUTTERBUCK, JAMES JACOBS and DR. RICHARD DORLING for the development of the Tissue Physically-Based Character Simulation Framework.",This framework faithfully and robustly simulates the effects of anatomical structures underlying a character's skin. The resulting dynamic and secondary motions provide a new level of realism to computer-generated creatures.,
1942 (15th),ACTOR,James Cagney,,,Yankee Doodle Dandy,"{""George M. Cohan""}",,,,,,,,,
1967 (40th),MUSIC (Original Music Score),Elmer Bernstein,,,Thoroughly Modern Millie,,,,,,,,,,
1992 (65th),ACTRESS IN A SUPPORTING ROLE,Marisa Tomei,,,My Cousin Vinny,"{""Mona Lisa Vito""}",,,,,,,,,
1978 (51st),ACTRESS IN A LEADING ROLE,Jane Fonda,,,Coming Home,"{""Sally Hyde""}",,,,,,,,,
2008 (81st),DIRECTING,Danny Boyle,,,Slumdog Millionaire,,,,,,,,,,
1993 (66th),SCIENTIFIC AND TECHNICAL AWARD (Technical Achievement Award),,,,,,,,,,,,To WALLY MILLS for the concept; and GARY STADLER and GUSTAVE PARADA for the design of the Cinemills Lamp Protection System.,,
1977 (50th),SCIENTIFIC OR TECHNICAL AWARD (Class II),,,,,,,,,,,,"To JOSEPH D. KELLY, EMORY M. COHEN, BARRY K. HENLEY, HAMMOND H. HOLT and JOHN AGALSOFF of Glen Glenn Sound for the concept and development of a Post-production Audio Processing System for Motion Picture Films.",,
1957 (30th),DIRECTING,David Lean,,,The Bridge on the River Kwai,,,,,,,,,,
2008 (81st),ACTOR IN A SUPPORTING ROLE,Heath Ledger,,,The Dark Knight,"{""Joker""}",,,,,,,,,
1965 (38th),CINEMATOGRAPHY (Black-and-White),Ernest Laszlo,,,Ship of Fools,,,,,,,,,,
2018 (91st),SOUND MIXING,"Paul Massey, Tim Cavagin and John Casali",,,Bohemian Rhapsody,,,,,,,,,,
1951 (24th),SHORT SUBJECT (Two-reel),"Walt Disney, Producer",,,Nature's Half Acre,,,,,,,,,,
1945 (18th),ART DIRECTION (Color),"Art Direction:  Hans Dreier, Ernst Fegte;  Interior Decoration:  Sam Comer",,,Frenchman's Creek,,,,,,,,,,
1954 (27th),SHORT SUBJECT (One-reel),"Robert Youngson, Producer",,,This Mechanical Age,,,,,,,,,,
1960 (33rd),MUSIC (Scoring of a Musical Picture),"Morris Stoloff, Harry Sukman",,,Song without End (The Story of Franz Liszt),,,,,,,,,,
1981 (54th),ACTOR IN A LEADING ROLE,Henry Fonda,,,On Golden Pond,"{""Norman Thayer, Jr.""}",,,,,,,,,
1943 (16th),FILM EDITING,George Amy,,,Air Force,,,,,,,,,,
2001 (74th),ANIMATED FEATURE FILM,Aron Warner,,,Shrek,,,,,,,,,,
1943 (16th),DOCUMENTARY (Short Subject),United States Navy,,,December 7th,,,,,,,,,,
2008 (81st),DOCUMENTARY (Feature),James Marsh and Simon Chinn,,,Man on Wire,,,,,,,,,,
1972 (45th),SCIENTIFIC OR TECHNICAL AWARD (Class II),,,,,,,,,,,,To JOSEPH E. BLUTH for research and development in the field of electronic photography and transfer of video tape to motion picture film.,,
1985 (58th),MEDAL OF COMMENDATION,,,,,,,,,,,,"To John H. Whitney, Sr. for Cinematic Pioneering.",,
2016 (89th),SCIENTIFIC AND TECHNICAL AWARD (Scientific and Engineering Award),,,,,,,,,,,,To ARRI for the pioneering design and engineering of the Super 35 format Alexa digital camera system.,"With an intuitive design and appealing image reproduction, achieved through close collaboration with filmmakers, ARRI's Alexa cameras were among the first digital cameras widely adopted by cinematographers.",
1965 (38th),FOREIGN LANGUAGE FILM,Czechoslovakia,,,The Shop on Main Street,,,,,,,,,,
1932/33 (6th),SCIENTIFIC OR TECHNICAL AWARD (Class III),,,,,,,,,,,,"To FOX FILM CORPORATION, FRED JACKMAN and WARNER BROS. PICTURES, INC., and SIDNEY SANDERS of RKO Studios, Inc., for their development and effective use of the translucent cellulose screen in composite photography.",,
1982 (55th),JEAN HERSHOLT HUMANITARIAN AWARD,Walter Mirisch,,,,,,,,,,,,,
1944 (17th),MUSIC (Scoring of a Musical Picture),"Morris Stoloff, Carmen Dragon",,,Cover Girl,,,,,,,,,,
1981 (54th),MAKEUP,Rick Baker,,,An American Werewolf in London,,,,,,,,,,
1949 (22nd),ACTOR IN A SUPPORTING ROLE,Dean Jagger,,,Twelve O'Clock High,"{""Major Stovall""}",,,,,,,,,
1953 (26th),ACTOR IN A SUPPORTING ROLE,Frank Sinatra,,,From Here to Eternity,"{""Angelo Maggio""}",,,,,,,,,
1973 (46th),WRITING (Screenplay--based on material from another medium),William Peter Blatty,,,The Exorcist,,,,,,,,,,
1959 (32nd),MUSIC (Scoring of a Musical Picture),"Andre Previn, Ken Darby",,,Porgy and Bess,,,,,,,,,,
1965 (38th),SPECIAL VISUAL EFFECTS,John Stears,,,Thunderball,,,,,,,,,,
1940 (13th),CINEMATOGRAPHY (Color),Georges Périnal,,,The Thief of Bagdad,,,,,,,,,,
1994 (67th),ACTRESS IN A LEADING ROLE,Jessica Lange,,,Blue Sky,"{""Carly Marshall""}",,,,,,,,,
1964 (37th),WRITING (Story and Screenplay--written directly for the screen),"Story by S. H. Barnett;  Screenplay by Peter Stone, Frank Tarloff",,,Father Goose,,,,,,,,,,
1952 (25th),DOCUMENTARY (Feature),"Irwin Allen, Producer",,,The Sea around Us,,,,,,,,,,
1947 (20th),SCIENTIFIC OR TECHNICAL AWARD (Class II),,,,,,,,,,,,To C. C. DAVIS and ELECTRICAL RESEARCH PRODUCTS DIVISION OF WESTERN ELECTRIC COMPANY for the development and application of an improved film drive filter mechanism.,,
2022 (95th),ACTOR IN A LEADING ROLE,Brendan Fraser,,,The Whale,"{""Charlie""}",,,,,,,,,
1970 (43rd),IRVING G. THALBERG MEMORIAL AWARD,Ingmar Bergman,,,,,,,,,,,,,
1964 (37th),HONORARY AWARD,,,,,,,,,,,,To William Tuttle for his outstanding make-up achievement for 7 Faces of Dr. Lao.,,
1961 (34th),COSTUME DESIGN (Color),Irene Sharaff,,,West Side Story,,,,,,,,,,
1936 (9th),DANCE DIRECTION,Seymour Felix,,,The Great Ziegfeld,,,,,,,,,,
1995 (68th),MUSIC (Original Musical or Comedy Score),Music by Alan Menken; Lyrics by Stephen Schwartz; Orchestral Score by Alan Menken,,,Pocahontas,,,,,,,,,,
1987 (60th),FILM EDITING,Gabriella Cristiani,,,The Last Emperor,,,,,,,,,,
1951 (24th),HONORARY FOREIGN LANGUAGE FILM AWARD,,,,,,,,,,,,To Rashomon - voted by the Board of Governors as the most outstanding foreign language film released in the United States during 1951.,,
2006 (79th),MUSIC (Original Score),Gustavo Santaolalla,,,Babel,,,,,,,,,,
1964 (37th),SPECIAL VISUAL EFFECTS,"Peter Ellenshaw, Eustace Lycett, Hamilton Luske",,,Mary Poppins,,,,,,,,,,
1971 (44th),MUSIC (Song--Original for the Picture),Music and Lyrics by Isaac Hayes,,,Shaft,,,,,,,,,,
1959 (32nd),FILM EDITING,"Ralph E. Winters, John D. Dunning",,,Ben-Hur,,,,,,,,,,
2021 (94th),DOCUMENTARY (Short Subject),Ben Proudfoot,,,The Queen of Basketball,,,,,,,,,,
2018 (91st),FILM EDITING,John Ottman,,,Bohemian Rhapsody,,,,,,,,,,
1973 (46th),DOCUMENTARY (Feature),"Kieth Merrill, Producer",,,The Great American Cowboy,,,,,,,,,,
1953 (26th),ACTRESS,Audrey Hepburn,,,Roman Holiday,"{""Princess Anne""}",,,,,,,,,
2008 (81st),CINEMATOGRAPHY,Anthony Dod Mantle,,,Slumdog Millionaire,,,,,,,,,,
2022 (95th),ANIMATED FEATURE FILM,"Guillermo del Toro, Mark Gustafson, Gary Ungar and Alex Bulkley",,,Guillermo del Toro's Pinocchio,,,,,,,,,,
1978 (51st),CINEMATOGRAPHY,Nestor Almendros,,,Days of Heaven,,,,,,,,,,
1954 (27th),HONORARY AWARD,,,,,,,,,,,,To Bausch & Lomb Optical Company for their contributions to the advancement of the motion picture industry.,,
2000 (73rd),COSTUME DESIGN,Janty Yates,,,Gladiator,,,,,,,,,,
2022 (95th),INTERNATIONAL FEATURE FILM,Germany,,,All Quiet on the Western Front,,,,,,,,,,
1942 (15th),SPECIAL AWARD,,,,,,,,,,,,To Charles Boyer for his progressive cultural achievement in establishing the French Research Foundation in Los Angeles as a source of reference for the Hollywood Motion Picture Industry.,,
1977 (50th),SPECIAL ACHIEVEMENT AWARD (Sound Effects Editing),Frank E. Warner,,,Close Encounters of the Third Kind,,,,,,,,,,
1982 (55th),DOCUMENTARY (Short Subject),"Edward Le Lorrain and Terri Nash, Producers",,,If You Love This Planet,,,,,,,,,,
2021 (94th),SHORT FILM (Animated),Alberto Mielgo and Leo Sanchez,,,The Windshield Wiper,,,,,,,,,,
2005 (78th),DOCUMENTARY (Short Subject),Corinne Marrinan and Eric Simonson,,,A Note of Triumph: The Golden Age of Norman Corwin,,,,,,,,,,
1975 (48th),JEAN HERSHOLT HUMANITARIAN AWARD,Dr. Jules C. Stein,,,,,,,,,,,,,
2003 (76th),BEST PICTURE,"Barrie M. Osborne, Peter Jackson and Fran Walsh, Producers",,,The Lord of the Rings: The Return of the King,,,,,,,,,,
1952 (25th),FILM EDITING,"Elmo Williams, Harry Gerstad",,,High Noon,,,,,,,,,,
1952 (25th),SHORT SUBJECT (Two-reel),"Walt Disney, Producer",,,Water Birds,,,,,,,,,,
2011 (84th),MAKEUP,Mark Coulier and J. Roy Helland,,,The Iron Lady,,,,,,,,,,
1940 (13th),SPECIAL AWARD,,,,,,,,,,,,"To Bob Hope, in recognition of his unselfish services to the Motion Picture Industry.",,
1938 (11th),IRVING G. THALBERG MEMORIAL AWARD,Hal B. Wallis,,,,,,,,,,,,,[NOTE: This is the only year that nominations were announced for the Thalberg award.]
1962 (35th),SHORT SUBJECT (Cartoon),"John Hubley and Faith Hubley, Producers",,,The Hole,,,,,,,,,,
2009 (82nd),ART DIRECTION,Production Design: Rick Carter and Robert Stromberg; Set Decoration: Kim Sinclair,,,Avatar,,,,,,,,,,
1968 (41st),WRITING (Story and Screenplay--written directly for the screen),Mel Brooks,,,The Producers,,,,,,,,,,
1991 (64th),IRVING G. THALBERG MEMORIAL AWARD,George Lucas,,,,,,,,,,,,,
1962 (35th),COSTUME DESIGN (Color),Mary Wills,,,The Wonderful World of the Brothers Grimm,,,,,,,,,,
1940 (13th),WRITING (Original Screenplay),Preston Sturges,,,The Great McGinty,,,,,,,,,,
1992 (65th),FILM EDITING,Joel Cox,,,Unforgiven,,,,,,,,,,
1952 (25th),WRITING (Story and Screenplay),T. E. B. Clarke,,,The Lavender Hill Mob,,,,,,,,,,
1995 (68th),BEST PICTURE,"Mel Gibson, Alan Ladd, Jr. and Bruce Davey, Producers",,,Braveheart,,,,,,,,,,
2004 (77th),JEAN HERSHOLT HUMANITARIAN AWARD,Roger Mayer,,,,,,,,,,,,,
2005 (78th),ACTRESS IN A SUPPORTING ROLE,Rachel Weisz,,,The Constant Gardener,"{""Tessa Quayle""}",,,,,,,,,
1992 (65th),FOREIGN LANGUAGE FILM,France,,,Indochine,,,,,,,,,,
2022 (95th),SOUND,"Mark Weingarten, James H. Mather, Al Nelson, Chris Burdon and Mark Taylor",,,Top Gun: Maverick,,,,,,,,,,
2003 (76th),FILM EDITING,Jamie Selkirk,,,The Lord of the Rings: The Return of the King,,,,,,,,,,
1963 (36th),ART DIRECTION (Color),"Art Direction:  John DeCuir, Jack Martin Smith, Hilyard Brown, Herman Blumenthal, Elven Webb, Maurice Pelling, Boris Juraga;  Set Decoration:  Walter M. Scott, Paul S. Fox, Ray Moyer",,,Cleopatra,,,,,,,,,,
2006 (79th),ACTRESS IN A SUPPORTING ROLE,Jennifer Hudson,,,Dreamgirls,"{""Effie White""}",,,,,,,,,
1978 (51st),MUSIC (Original Score),Giorgio Moroder,,,Midnight Express,,,,,,,,,,
1978 (51st),SCIENTIFIC OR TECHNICAL AWARD (Technical Achievement Award),,,,,,,,,,,,To KARL MACHER and GLENN M. BERGGREN of Isco Optische Werke for the development and introduction of the Cinelux-ULTRA Lens for 35mm Motion Picture Projection.,,
1986 (59th),SOUND,"John K. Wilkinson, Richard Rogers, Charles 'Bud' Grenzbach,  Simon Kaye",,,Platoon,,,,,,,,,,
1984 (57th),SHORT FILM (Live Action),"Mike Hoover, Producer",,,Up,,,,,,,,,,
1957 (30th),MUSIC (Song),Music by James Van Heusen; Lyrics by Sammy Cahn,,,The Joker Is Wild,,,,,,,,,,
2009 (82nd),MUSIC (Original Song),Music and Lyric by Ryan Bingham and T Bone Burnett,,,Crazy Heart,,,,,,,,,,
1946 (19th),BEST MOTION PICTURE,Samuel Goldwyn Productions,,,The Best Years of Our Lives,,,,,,,,,,
1980 (53rd),BEST PICTURE,"Ronald L. Schwary, Producer",,,Ordinary People,,,,,,,,,,
1950 (23rd),DIRECTING,Joseph L. Mankiewicz,,,All about Eve,,,,,,,,,,
1944 (17th),SPECIAL EFFECTS,"Photographic Effects by A. Arnold Gillespie, Donald Jahraus, Warren Newcombe; Sound Effects by Douglas Shearer",,,Thirty Seconds over Tokyo,,,,,,,,,,
1949 (22nd),COSTUME DESIGN (Color),"Leah Rhodes, Travilla, Marjorie Best",,,The Adventures of Don Juan,,,,,,,,,,
1999 (72nd),WRITING (Screenplay Written Directly for the Screen),Alan Ball,,,American Beauty,,,,,,,,,,
1984 (57th),ACTOR IN A SUPPORTING ROLE,Haing S. Ngor,,,The Killing Fields,"{""Dith Pran""}",,,,,,,,,
1953 (26th),WRITING (Screenplay),Daniel Taradash,,,From Here to Eternity,,,,,,,,,,
1999 (72nd),IRVING G. THALBERG MEMORIAL AWARD,Warren Beatty,,,,,,,,,,,,,
1946 (19th),DOCUMENTARY (Short Subject),United States Department of War,,,Seeds of Destiny,,,,,,,,,,
1943 (16th),MUSIC (Scoring of a Musical Picture),Ray Heindorf,,,This Is the Army,,,,,,,,,,
2015 (88th),SHORT FILM (Animated),Gabriel Osorio and Pato Escala,,,Bear Story,,,,,,,,,,
1992 (65th),ART DIRECTION,Art Direction:  Luciana Arrighi;  Set Decoration:  Ian Whittaker,,,Howards End,,,,,,,,,,
1975 (48th),MUSIC (Original Song),Music and Lyrics by Keith Carradine,,,Nashville,,,,,,,,,,
1979 (52nd),MUSIC (Original Song Score and Its Adaptation -or- Adaptation Score),Adaptation Score by Ralph Burns,,,All That Jazz,,,,,,,,,,
2007 (80th),SOUND EDITING,Karen Baker Landers and Per Hallberg,,,The Bourne Ultimatum,,,,,,,,,,
2007 (80th),GORDON E. SAWYER AWARD,,,,,,,,,,,,David A. Grafton,,
1993 (66th),GORDON E. SAWYER AWARD,,,,,,,,,,,,Petro Vlahos,,
2009 (82nd),SCIENTIFIC AND TECHNICAL AWARD (Scientific and Engineering Award),,,,,,,,,,,,"To PER CHRISTENSEN, MICHAEL BUNNELL and CHRISTOPHE HERY for the development of point-based rendering for indirect illumination and ambient occlusion.","Much faster than previous ray-traced methods, this computer graphics technique has enabled color bleeding effects and realistic shadows for complex scenes in motion pictures.",
1960 (33rd),HONORARY AWARD,,,,,,,,,,,,"To Gary Cooper for his many memorable screen performances and the international recognition he, as an individual, has gained for the motion picture industry.",,
1982 (55th),SCIENTIFIC OR TECHNICAL AWARD (Academy Award of Merit),,,,,,,,,,,,"To AUGUST ARNOLD and ERICH KAESTNER of Arnold & Richter, GmbH, for the concept and engineering of the first operational 35mm, hand-held, spinning-mirror reflex, motion picture camera.",,
1997 (70th),WRITING (Screenplay Based on Material Previously Produced or Published),"Brian Helgeland, Curtis Hanson",,,L.A. Confidential,,,,,,,,,,
1976 (49th),DIRECTING,John G. Avildsen,,,Rocky,,,,,,,,,,
2020 (93rd),PRODUCTION DESIGN,Production Design: Donald Graham Burt; Set Decoration: Jan Pascale,,,Mank,,,,,,,,,,
1969 (42nd),COSTUME DESIGN,Margaret Furse,,,Anne of the Thousand Days,,,,,,,,,,
1971 (44th),FILM EDITING,Jerry Greenberg,,,The French Connection,,,,,,,,,,
1942 (15th),DIRECTING,William Wyler,,,Mrs. Miniver,,,,,,,,,,
1954 (27th),BEST MOTION PICTURE,"Sam Spiegel, Producer",,,On the Waterfront,,,,,,,,,,
1979 (52nd),DOCUMENTARY (Short Subject),"Saul J. Turell, Producer",,,Paul Robeson: Tribute to an Artist,,,,,,,,,,
1979 (52nd),HONORARY AWARD,,,,,,,,,,,,To Alec Guinness for advancing the art of screen acting through a host of memorable and distinguished performances.,,
1966 (39th),COSTUME DESIGN (Color),"Elizabeth Haffenden, Joan Bridge",,,A Man for All Seasons,,,,,,,,,,
2000 (73rd),BEST PICTURE,"Douglas Wick, David Franzoni and Branko Lustig, Producers",,,Gladiator,,,,,,,,,,
1938 (11th),WRITING (Screenplay),"Screenplay and Dialogue by George Bernard Shaw; Adaptation by W. P. Lipscomb, Cecil Lewis, Ian Dalrymple",,,Pygmalion,,,,,,,,,,
1981 (54th),COSTUME DESIGN,Milena Canonero,,,Chariots of Fire,,,,,,,,,,
1938 (11th),MUSIC (Original Score),Erich Wolfgang Korngold,,,The Adventures of Robin Hood,,,,,,,,,,
1986 (59th),COSTUME DESIGN,"Jenny Beavan, John Bright",,,A Room with a View,,,,,,,,,,
1990 (63rd),GORDON E. SAWYER AWARD,,,,,,,,,,,,Stefan Kudelski,,
1988 (61st),WRITING (Screenplay Based on Material from Another Medium),Christopher Hampton,,,Dangerous Liaisons,,,,,,,,,,
1932/33 (6th),SCIENTIFIC OR TECHNICAL AWARD (Class II),,,,,,,,,,,,"To ELECTRICAL RESEARCH PRODUCTS, INC. for their wide range recording and reproducing system.",,
1948 (21st),SCIENTIFIC OR TECHNICAL AWARD (Class III),,,,,,,,,,,,"To MARTY MARTIN, JACK LANNON, RUSSELL SHEARMAN and the RKO RADIO STUDIO SPECIAL EFFECTS DEPARTMENT for the development of a new method of simulating falling snow on motion picture sets.",,
2005 (78th),MUSIC (Original Song),"Music and Lyric by Jordan Houston, Cedric Coleman and Paul Beauregard",,,Hustle & Flow,,,,,,,,,,
1979 (52nd),MUSIC (Original Song),Music by David Shire; Lyric by Norman Gimbel,,,Norma Rae,,,,,,,,,,
2006 (79th),DIRECTING,Martin Scorsese,,,The Departed,,,,,,,,,,
1957 (30th),SPECIAL EFFECTS,Audible Effects by Walter Rossi,,,The Enemy Below,,,,,,,,,,
1978 (51st),SCIENTIFIC OR TECHNICAL AWARD (Academy Award of Merit),,,,,,,,,,,,To EASTMAN KODAK COMPANY for the research and development of a Duplicating Color film for Motion Pictures.,,
2006 (79th),SOUND EDITING,Alan Robert Murray and Bub Asman,,,Letters from Iwo Jima,,,,,,,,,,
2009 (82nd),ACTRESS IN A LEADING ROLE,Sandra Bullock,,,The Blind Side,"{""Leigh Anne Tuohy""}",,,,,,,,,
2002 (75th),VISUAL EFFECTS,"Jim Rygiel, Joe Letteri, Randall William Cook, Alex Funke",,,The Lord of the Rings: The Two Towers,,,,,,,,,,
1967 (40th),WRITING (Story and Screenplay--written directly for the screen),William Rose,,,Guess Who's Coming to Dinner,,,,,,,,,,
1962 (35th),SCIENTIFIC OR TECHNICAL AWARD (Class II),,,,,,,,,,,,To RALPH CHAPMAN for the design and development of an advanced motion picture camera crane.,,
1980 (53rd),DOCUMENTARY (Feature),"Murray Lerner, Producer",,,From Mao to Mozart: Isaac Stern in China,,,,,,,,,,
1987 (60th),DOCUMENTARY (Feature),"Aviva Slesin, Producer",,,The Ten-Year Lunch: The Wit and Legend of the Algonquin Round Table,,,,,,,,,,
2019 (92nd),SHORT FILM (Live Action),Marshall Curry,,,The Neighbors' Window,,,,,,,,,,
1941 (14th),CINEMATOGRAPHY (Black-and-White),Arthur Miller,,,How Green Was My Valley,,,,,,,,,,
1942 (15th),SPECIAL EFFECTS,"Photographic Effects by Gordon Jennings, Farciot Edouart, William L. Pereira; Sound Effects by Louis Mesenkop",,,Reap the Wild Wind,,,,,,,,,,
1949 (22nd),CINEMATOGRAPHY (Color),Winton Hoch,,,She Wore a Yellow Ribbon,,,,,,,,,,
1992 (65th),BEST PICTURE,"Clint Eastwood, Producer",,,Unforgiven,,,,,,,,,,
1993 (66th),JEAN HERSHOLT HUMANITARIAN AWARD,Paul Newman,,,,,,,,,,,,,
1984 (57th),SPECIAL ACHIEVEMENT AWARD (Sound Effects Editing),Kay Rose,,,The River,,,,,,,,,,
1998 (71st),WRITING (Screenplay Written Directly for the Screen),"Marc Norman, Tom Stoppard",,,Shakespeare in Love,,,,,,,,,,
1971 (44th),SHORT SUBJECT (Animated),"Ted Petok, Producer",,,The Crunch Bird,,,,,,,,,,
1991 (64th),DIRECTING,Jonathan Demme,,,The Silence of the Lambs,,,,,,,,,,
1968 (41st),MUSIC (Song--Original for the Picture),Music by Michel Legrand; Lyrics by Alan Bergman and Marilyn Bergman,,,The Thomas Crown Affair,,,,,,,,,,
1951 (24th),BEST MOTION PICTURE,"Arthur Freed, Producer",,,An American in Paris,,,,,,,,,,
2011 (84th),VISUAL EFFECTS,"Rob Legato, Joss Williams, Ben Grossmann and Alex Henning",,,Hugo,,,,,,,,,,
2004 (77th),ACTOR IN A SUPPORTING ROLE,Morgan Freeman,,,Million Dollar Baby,"{""Eddie Scrap-Iron Dupris""}",,,,,,,,,
2015 (88th),SCIENTIFIC AND TECHNICAL AWARD (Technical Achievement Award),,,,,,,,,,,,"To MICHAEL JOHN KEESLING for the design and development of Image Shaker, an optical system that convincingly creates the illusion of the camera shaking in a variable and repeatable manner.","The Image Shaker was unique and superior to alternatives in use when it was invented two decades ago, and it continues to be used today.",
1978 (51st),MUSIC (Adaptation Score),Joe Renzetti,,,The Buddy Holly Story,,,,,,,,,,
2007 (80th),ACTRESS IN A LEADING ROLE,Marion Cotillard,,,La Vie en Rose,"{""Edith Piaf""}",,,,,,,,,
2006 (79th),HONORARY AWARD,,,,,,,,,,,,To Ennio Morricone in recognition of his magnificent and multifaceted contributions to the art of film music.,,
1968 (41st),WRITING (Story and Screenplay--written directly for the screen),Mel Brooks,,,The Producers,,,,,,,,,,
1999 (72nd),HONORARY AWARD,,,,,,,,,,,,To Andrzej Wajda in recognition of five decades of extraordinary film direction.,,
1989 (62nd),ACTRESS IN A LEADING ROLE,Jessica Tandy,,,Driving Miss Daisy,"{""Daisy Werthan""}",,,,,,,,,
1927/28 (1st),OUTSTANDING PICTURE,Paramount Famous Lasky,,,Wings,,,,,,,,,,
1985 (58th),ART DIRECTION,Art Direction:  Stephen Grimes;  Set Decoration:  Josie MacAvin,,,Out of Africa,,,,,,,,,,
1975 (48th),SPECIAL ACHIEVEMENT AWARD (Sound Effects),Peter Berkos,,,The Hindenburg,,,,,,,,,,
1959 (32nd),MUSIC (Song),Music by James Van Heusen; Lyrics by Sammy Cahn,,,A Hole in the Head,,,,,,,,,,
1981 (54th),ACTRESS IN A SUPPORTING ROLE,Maureen Stapleton,,,Reds,"{""Emma Goldman""}",,,,,,,,,
2010 (83rd),IRVING G. THALBERG MEMORIAL AWARD,Francis Ford Coppola,,,,,,,,,,,,,
2000 (73rd),SCIENTIFIC AND TECHNICAL AWARD (Academy Award of Merit),,,,,,,,,,,,"To ROB COOK, LOREN CARPENTER and ED CATMULL for their significant advancements to the field of motion picture rendering as exemplified in Pixar's ""Renderman.""",Their broad professional influence in the industry continues to inspire and contribute to the advancement of computer-generated imagery for motion pictures.,
1967 (40th),FILM EDITING,Hal Ashby,,,In the Heat of the Night,,,,,,,,,,
2006 (79th),JEAN HERSHOLT HUMANITARIAN AWARD,Sherry Lansing,,,,,,,,,,,,,
1962 (35th),ACTOR IN A SUPPORTING ROLE,Ed Begley,,,Sweet Bird of Youth,"{""Tom 'Boss' Finley""}",,,,,,,,,
1961 (34th),SHORT SUBJECT (Cartoon),Zagreb Film,,,Ersatz (The Substitute),,,,,,,,,,
1979 (52nd),COSTUME DESIGN,Albert Wolsky,,,All That Jazz,,,,,,,,,,
1958 (31st),WRITING (Screenplay--based on material from another medium),Alan Jay Lerner,,,Gigi,,,,,,,,,,
1982 (55th),SHORT FILM (Animated),"Zbigniew Rybczynski, Producer",,,Tango,,,,,,,,,,
1997 (70th),JOHN A. BONNER MEDAL OF COMMENDATION,,,,,,,,,,,,To Pete Clark in appreciation for outstanding service and dedication in upholding the high standards of the Academy of Motion Picture Arts and Sciences.,,
1963 (36th),BEST PICTURE,"Tony Richardson, Producer",,,Tom Jones,,,,,,,,,,
1984 (57th),SOUND,"Mark Berger, Tom Scott, Todd Boekelheide, Chris Newman",,,Amadeus,,,,,,,,,,
1948 (21st),WRITING (Screenplay),John Huston,,,The Treasure of the Sierra Madre,,,,,,,,,,
1973 (46th),MUSIC (Original Dramatic Score),Marvin Hamlisch,,,The Way We Were,,,,,,,,,,
1952 (25th),SCIENTIFIC OR TECHNICAL AWARD (Class III),,,,,,,,,,,,"To the PROJECTION, STILL PHOTOGRAPHIC and DEVELOPMENT ENGINEERING DEPARTMENTS of METRO-GOLDWYN-MAYER STUDIO for an improved method of projecting photographic backgrounds.",,
2022 (95th),MUSIC (Original Score),Volker Bertelmann,,,All Quiet on the Western Front,,,,,,,,,,
1973 (46th),SOUND,"Robert Knudson, Chris Newman",,,The Exorcist,,,,,,,,,,
1962 (35th),JEAN HERSHOLT HUMANITARIAN AWARD,Steve Broidy,,,,,,,,,,,,,
1955 (28th),BEST MOTION PICTURE,"Harold Hecht, Producer",,,Marty,,,,,,,,,,
1953 (26th),DIRECTING,Fred Zinnemann,,,From Here to Eternity,,,,,,,,,,
1989 (62nd),SOUND,"Donald O. Mitchell, Gregg C. Rudloff, Elliot Tyson, Russell Williams II",,,Glory,,,,,,,,,,
1977 (50th),ACTRESS IN A SUPPORTING ROLE,Vanessa Redgrave,,,Julia,"{""Julia""}",,,,,,,,,
1943 (16th),SPECIAL EFFECTS,Photographic Effects by Fred Sersen; Sound Effects by Roger Heman,,,Crash Dive,,,,,,,,,,
1935 (8th),FILM EDITING,Ralph Dawson,,,A Midsummer Night's Dream,,,,,,,,,,
2004 (77th),MUSIC (Original Song),Music and Lyric by Jorge Drexler,,,The Motorcycle Diaries,,,,,,,,,,
1960 (33rd),WRITING (Screenplay--based on material from another medium),Richard Brooks,,,Elmer Gantry,,,,,,,,,,
1938 (11th),DIRECTING,Frank Capra,,,You Can't Take It with You,,,,,,,,,,
2015 (88th),JEAN HERSHOLT HUMANITARIAN AWARD,Debbie Reynolds,,,,,,,,,,,,,
1941 (14th),DOCUMENTARY (Short Subject),National Film Board of Canada,,,Churchill's Island,,,,,,,,,,
1987 (60th),ART DIRECTION,"Art Direction:  Ferdinando Scarfiotti;  Set Decoration:  Bruno Cesari, Osvaldo Desideri",,,The Last Emperor,,,,,,,,,,
1936 (9th),MUSIC (Song),Music by Jerome Kern; Lyrics by Dorothy Fields,,,Swing Time,,,,,,,,,,
1934 (7th),SCIENTIFIC OR TECHNICAL AWARD (Class III),,,,,,,,,,,,"To COLUMBIA PICTURES CORPORATION for their application of the Vertical Cut Disc Method (hill and dale recording) to actual studio production, with their recording of the sound on the picture One Night of Love.",,
2014 (87th),FILM EDITING,Tom Cross,,,Whiplash,,,,,,,,,,
1961 (34th),HONORARY AWARD,,,,,,,,,,,,"To William L. Hendricks for his outstanding patriotic service in the conception, writing and production of the Marine Corps film, A Force in Readiness, which has brought honor to the Academy and the motion picture industry.",,
1981 (54th),WRITING (Screenplay Based on Material from Another Medium),Ernest Thompson,,,On Golden Pond,,,,,,,,,,
1997 (70th),MAKEUP,"Rick Baker, David LeRoy Anderson",,,Men in Black,,,,,,,,,,
1938 (11th),ACTRESS IN A SUPPORTING ROLE,Fay Bainter,,,Jezebel,"{""Aunt Belle Massey""}",,,,,,,,,
1949 (22nd),WRITING (Screenplay),Joseph L. Mankiewicz,,,A Letter to Three Wives,,,,,,,,,,
1943 (16th),ACTRESS IN A SUPPORTING ROLE,Katina Paxinou,,,For Whom the Bell Tolls,"{""Pilar""}",,,,,,,,,
1975 (48th),SCIENTIFIC OR TECHNICAL AWARD (Class III),,,,,,,,,,,,To LAWRENCE W. BUTLER and ROGER BANKS for the concept of applying low inertia and stepping electric motors to film transport systems and optical printers for motion picture production.,,
2020 (93rd),CINEMATOGRAPHY,Erik Messerschmidt,,,Mank,,,,,,,,,,
1992 (65th),MUSIC (Original Song),Music by Alan Menken; Lyric by Tim Rice,,,Aladdin,,,,,,,,,,
2022 (95th),ACTOR IN A SUPPORTING ROLE,Ke Huy Quan,,,Everything Everywhere All at Once,"{""Waymond Wang""}",,,,,,,,,
2010 (83rd),SHORT FILM (Live Action),Luke Matheny,,,God of Love,,,,,,,,,,
2003 (76th),ACTOR IN A LEADING ROLE,Sean Penn,,,Mystic River,"{""Jimmy Markum""}",,,,,,,,,
1980 (53rd),ACTRESS IN A SUPPORTING ROLE,Mary Steenburgen,,,Melvin and Howard,"{""Lynda Dummar""}",,,,,,,,,
