award_year,category,name1,name2,name3,film_title,character_name,film_title2,character_name2,film_title3,character_name3,film_title4,character_name4,honorary_statement,description,note
1954 (27th),SHORT SUBJECT (Two-reel),"Denis Sanders and Terry Sanders, Producers",,,A Time Out of War,,,,,,,,,,
1968 (41st),FILM EDITING,Frank P. Keller,,,Bullitt,,,,,,,,,,
1978 (51st),SHORT FILM (Animated),"Eunice Macaulay and John Weldon, Producers",,,Special Delivery,,,,,,,,,,
1966 (39th),SPECIAL VISUAL EFFECTS,Art Cruickshank,,,Fantastic Voyage,,,,,,,,,,
1949 (22nd),CINEMATOGRAPHY (Black-and-White),Paul C. Vogel,,,Battleground,,,,,,,,,,
1970 (43rd),ART DIRECTION,"Art Direction:  Urie McCleary, Gil Parrondo;  Set Decoration:  Antonio Mateos, Pierre-Louis Thevenet",,,Patton,,,,,,,,,,
1963 (36th),SPECIAL EFFECTS,"Emil Kosa, Jr.",,,Cleopatra,,,,,,,,,,
2008 (81st),SHORT FILM (Live Action),Jochen Alexander Freydank,,,Spielzeugland (Toyland),,,,,,,,,,
1954 (27th),MUSIC (Music Score of a Dramatic or Comedy Picture),Dimitri Tiomkin,,,The High and the Mighty,,,,,,,,,,
1979 (52nd),SCIENTIFIC OR TECHNICAL AWARD (Technical Achievement Award),,,,,,,,,,,,"To MICHAEL V. CHEWEY, WALTER G. EGGERS and ALLEN HECHT of M-G-M Laboratories for the development of a Computer-controlled Paper Tape Programmer System and its applications in the motion picture laboratory.",,
1972 (45th),HONORARY AWARD,,,,,,,,,,,,"To Charles S. Boren, Leader for 38 years of the industry's enlightened labor relations and architect of its policy of non-discrimination.  With the respect and affection of all who work in films.",,"[NOTE: The Academy's Board of Governors voted to confer this award on January 6, 1973.  Mr. Robinson passed away on January 26th, and the award was accepted on his behalf by his wife.]"
1956 (29th),SOUND RECORDING,"20th Century-Fox Studio Sound Department, Carl Faulkner, Sound Director",,,The King and I,,,,,,,,,,
1944 (17th),SHORT SUBJECT (Two-reel),"Gordon Hollingshead, Producer",,,I Won't Play,,,,,,,,,,
1954 (27th),FILM EDITING,Gene Milford,,,On the Waterfront,,,,,,,,,,
1962 (35th),SOUND,"Shepperton Studio Sound Department, John Cox, Sound Director",,,Lawrence of Arabia,,,,,,,,,,
1945 (18th),ACTOR,Ray Milland,,,The Lost Weekend,"{""Don Birnam""}",,,,,,,,,
1983 (56th),MUSIC (Original Song Score or Adaptation Score),"Song Score by Michel Legrand, Alan Bergman and Marilyn Bergman",,,Yentl,,,,,,,,,,
1997 (70th),SOUND,"Gary Rydstrom, Tom Johnson, Gary Summers, Mark Ulano",,,Titanic,,,,,,,,,,
1971 (44th),COSTUME DESIGN,"Yvonne Blake, Antonio Castillo",,,Nicholas and Alexandra,,,,,,,,,,
1985 (58th),FOREIGN LANGUAGE FILM,Argentina,,,The Official Story,,,,,,,,,,
2009 (82nd),ACTOR IN A SUPPORTING ROLE,Christoph Waltz,,,Inglourious Basterds,"{""Col. Hans Landa""}",,,,,,,,,
2022 (95th),CINEMATOGRAPHY,James Friend,,,All Quiet on the Western Front,,,,,,,,,,
2021 (94th),PRODUCTION DESIGN,Production Design: Patrice Vermette; Set Decoration: Zsuzsanna Sipos,,,Dune,,,,,,,,,,
1990 (63rd),IRVING G. THALBERG MEMORIAL AWARD,David Brown and Richard D. Zanuck,,,,,,,,,,,,,
1965 (38th),FILM EDITING,William Reynolds,,,The Sound of Music,,,,,,,,,,
2017 (90th),ACTRESS IN A LEADING ROLE,Frances McDormand,,,"Three Billboards outside Ebbing, Missouri","{""Mildred""}",,,,,,,,,
1928/29 (2nd),ART DIRECTION,Cedric Gibbons,,,The Bridge of San Luis Rey,,,,,,,,,,"[NOTE: The award citation reads 'for 'The Bridge of San Luis Rey' and other pictures.'  THIS IS NOT AN OFFICIAL NOMINATION.  There were no announcements of nominations, no certificates of nomination or honorable mention, and only the winners (*) were revealed during the awards banquet on April 3, 1930.]"
2007 (80th),SCIENTIFIC AND TECHNICAL AWARD (Academy Award of Merit),,,,,,,,,,,,To the EASTMAN KODAK COMPANY for the development of photographic emulsion technologies incorporated into the Kodak Vision2 family of color negative films.,"These new technologies are breakthroughs in film speed, grain and sharpness that have made a significant impact on the motion picture industry. The Vision2 family allows wider use of high-speed color negative film, lower light levels on set and faster set-ups. Most importantly, Vision2 improves the overall picture quality in theatrical presentation.",
1952 (25th),ART DIRECTION (Color),Art Direction:  Paul Sheriff;  Set Decoration:  Marcel Vertes,,,Moulin Rouge,,,,,,,,,,
1960 (33rd),SHORT SUBJECT (Cartoon),"William L. Snyder, Producer",,,Munro,,,,,,,,,,
2003 (76th),WRITING (Original Screenplay),Written by Sofia Coppola,,,Lost in Translation,,,,,,,,,,
1932/33 (6th),ACTRESS,Katharine Hepburn,,,Morning Glory,"{""Eva Lovelace""}",,,,,,,,,
1943 (16th),CINEMATOGRAPHY (Color),"Hal Mohr, W. Howard Greene",,,Phantom of the Opera,,,,,,,,,,
1939 (12th),SOUND RECORDING,"Universal Studio Sound Department, Bernard B. Brown, Sound Director",,,When Tomorrow Comes,,,,,,,,,,
1957 (30th),ACTRESS IN A SUPPORTING ROLE,Miyoshi Umeki,,,Sayonara,"{""Katsumi""}",,,,,,,,,
1967 (40th),SOUND,Samuel Goldwyn Studio Sound Department,,,In the Heat of the Night,,,,,,,,,,
2000 (73rd),ART DIRECTION,Tim Yip,,,"Crouching Tiger, Hidden Dragon",,,,,,,,,,
2018 (91st),PRODUCTION DESIGN,Production Design: Hannah Beachler; Set Decoration: Jay Hart,,,Black Panther,,,,,,,,,,
1959 (32nd),SHORT SUBJECT (Cartoon),"John Hubley, Producer",,,Moonbird,,,,,,,,,,
2018 (91st),JOHN A. BONNER MEDAL OF COMMENDATION,,,,,,,,,,,,To Curtis Clark in recognition of extraordinary service to the motion picture industry.,,
2002 (75th),SHORT FILM (Animated),Eric Armstrong,,,The ChubbChubbs!,,,,,,,,,,
2020 (93rd),SOUND,"Nicolas Becker, Jaime Baksht, Michellee Couttolenc, Carlos Cortés and Phillip Bladh",,,Sound of Metal,,,,,,,,,,
1973 (46th),ACTRESS,Glenda Jackson,,,A Touch of Class,"{""Vicki Allessio""}",,,,,,,,,
1965 (38th),COSTUME DESIGN (Black-and-White),Julie Harris,,,Darling,,,,,,,,,,
1969 (42nd),SHORT SUBJECT (Live Action),"Joan Keller Stern, Producer",,,The Magic Machines,,,,,,,,,,
1959 (32nd),SCIENTIFIC OR TECHNICAL AWARD (Class III),,,,,,,,,,,,To UB IWERKS of Walt Disney Prods. for the design of an improved optical printer for special effects and matte shots.,,
1988 (61st),ART DIRECTION,Art Direction:  Stuart Craig;  Set Decoration:  Gerard James,,,Dangerous Liaisons,,,,,,,,,,
2002 (75th),BEST PICTURE,"Martin Richards, Producer",,,Chicago,,,,,,,,,,
1942 (15th),OUTSTANDING MOTION PICTURE,Metro-Goldwyn-Mayer,,,Mrs. Miniver,,,,,,,,,,
1996 (69th),ACTOR IN A SUPPORTING ROLE,"Cuba Gooding, Jr.",,,Jerry Maguire,"{""Rod Tidwell""}",,,,,,,,,
2021 (94th),COSTUME DESIGN,Jenny Beavan,,,Cruella,,,,,,,,,,
1952 (25th),HONORARY AWARD,,,,,,,,,,,,To George Alfred Mitchell for the design and development of the camera which bears his name and for his continued and dominant presence in the field of cinematography.,,
2014 (87th),SHORT FILM (Animated),Patrick Osborne and Kristina Reed,,,Feast,,,,,,,,,,
1965 (38th),ACTOR,Lee Marvin,,,Cat Ballou,"{""Kid Shelleen/Tim Strawn""}",,,,,,,,,
1938 (11th),WRITING (Original Story),"Dore Schary, Eleanore Griffin",,,Boys Town,,,,,,,,,,
1968 (41st),COSTUME DESIGN,Danilo Donati,,,Romeo and Juliet,,,,,,,,,,
2021 (94th),ANIMATED FEATURE FILM,"Jared Bush, Byron Howard, Yvett Merino and Clark Spencer",,,Encanto,,,,,,,,,,
1951 (24th),CINEMATOGRAPHY (Black-and-White),William C. Mellor,,,A Place in the Sun,,,,,,,,,,
1981 (54th),SHORT FILM (Animated),"Frédéric Back, Producer",,,Crac,,,,,,,,,,
1993 (66th),HONORARY AWARD,,,,,,,,,,,,"To Deborah Kerr, in appreciation for a full career's worth of elegant and beautifully crafted performances.",,
2014 (87th),CINEMATOGRAPHY,Emmanuel Lubezki,,,Birdman or (The Unexpected Virtue of Ignorance),,,,,,,,,,
1938 (11th),OUTSTANDING PRODUCTION,Columbia,,,You Can't Take It with You,,,,,,,,,,
1971 (44th),MUSIC (Original Dramatic Score),Michel Legrand,,,Summer of '42,,,,,,,,,,
1942 (15th),FILM EDITING,Daniel Mandell,,,The Pride of the Yankees,,,,,,,,,,
1983 (56th),SOUND,"Mark Berger, Tom Scott, Randy Thom, David MacMillan",,,The Right Stuff,,,,,,,,,,
1935 (8th),OUTSTANDING PRODUCTION,Metro-Goldwyn-Mayer,,,Mutiny on the Bounty,,,,,,,,,,
1948 (21st),COSTUME DESIGN (Color),"Dorothy Jeakins, Karinska",,,Joan of Arc,,,,,,,,,,
1938 (11th),ART DIRECTION,Carl J. Weyl,,,The Adventures of Robin Hood,,,,,,,,,,
2014 (87th),COSTUME DESIGN,Milena Canonero,,,The Grand Budapest Hotel,,,,,,,,,,
2001 (74th),AWARD OF COMMENDATION,,,,,,,,,,,,To Rune Ericson for his pioneering development and 30 years of dedication to the Super 16mm format for motion pictures.,The Super 16mm film format has achieved a significant impact on the worldwide film industry by playing a major role in empowering low budget films to be produced for theatrical release.,
1990 (63rd),SCIENTIFIC OR TECHNICAL AWARD (Scientific and Engineering Award),,,,,,,,,,,,"To BRUCE WILTON and CARLOS ICINKOFF of Mechanical Concepts, Incorporated, for the development of the Mechanical Concepts Optical Printer Platform.",,
1967 (40th),MUSIC (Song),Music and Lyrics by Leslie Bricusse,,,Doctor Dolittle,,,,,,,,,,
1994 (67th),JEAN HERSHOLT HUMANITARIAN AWARD,Quincy Jones,,,,,,,,,,,,,
1952 (25th),SPECIAL EFFECTS,Metro-Goldwyn-Mayer,,,Plymouth Adventure,,,,,,,,,,
1975 (48th),IRVING G. THALBERG MEMORIAL AWARD,Mervyn LeRoy,,,,,,,,,,,,,
1966 (39th),SHORT SUBJECT (Live Action),"Edgar Anstey, Producer",,,Wild Wings,,,,,,,,,,
1997 (70th),WRITING (Screenplay Written Directly for the Screen),"Ben Affleck, Matt Damon",,,Good Will Hunting,,,,,,,,,,
1973 (46th),WRITING (Story and Screenplay--based on factual material or material not previously published or produced),David S. Ward,,,The Sting,,,,,,,,,,
1961 (34th),DOCUMENTARY (Feature),"Arthur Cohn and Rene Lafuite, Producers",,,Le Ciel et la Boue (Sky Above and Mud Beneath),,,,,,,,,,
1942 (15th),SHORT SUBJECT (Two-reel),Warner Bros.,,,Beyond the Line of Duty,,,,,,,,,,
1962 (35th),WRITING (Story and Screenplay--written directly for the screen),"Ennio de Concini, Alfredo Giannetti, Pietro Germi",,,Divorce--Italian Style,,,,,,,,,,
2001 (74th),MUSIC (Original Score),Howard Shore,,,The Lord of the Rings: The Fellowship of the Ring,,,,,,,,,,
2007 (80th),DOCUMENTARY (Short Subject),Cynthia Wade and Vanessa Roth,,,Freeheld,,,,,,,,,,
2018 (91st),IRVING G. THALBERG MEMORIAL AWARD,Kathleen Kennedy and Frank Marshall,,,,,,,,,,,,,
1969 (42nd),JEAN HERSHOLT HUMANITARIAN AWARD,George Jessel,,,,,,,,,,,,,
1989 (62nd),SCIENTIFIC OR TECHNICAL AWARD (Scientific and Engineering Award),,,,,,,,,,,,"To JAMES KETCHAM of JSK Engineering, for the excellence in engineering and the broad adaptability of the SDA521B Advance/Retard system for magnetic film sound dubbing.",,
2000 (73rd),SOUND,"Scott Millan, Bob Beemer, Ken Weston",,,Gladiator,,,,,,,,,,
2014 (87th),SOUND MIXING,"Craig Mann, Ben Wilkins and Thomas Curley",,,Whiplash,,,,,,,,,,
1981 (54th),MUSIC (Original Song),"Music and Lyric by Burt Bacharach, Carole Bayer Sager, Christopher Cross and Peter Allen",,,Arthur,,,,,,,,,,
1957 (30th),DOCUMENTARY (Feature),"Jerome Hill, Producer",,,Albert Schweitzer,,,,,,,,,,
1990 (63rd),MUSIC (Original Score),John Barry,,,Dances With Wolves,,,,,,,,,,
1990 (63rd),SHORT FILM (Live Action),Adam Davidson,,,The Lunch Date,,,,,,,,,,
1960 (33rd),WRITING (Story and Screenplay--written directly for the screen),"Billy Wilder, I. A. L. Diamond",,,The Apartment,,,,,,,,,,
1940 (13th),SPECIAL EFFECTS,Photographic Effects by Lawrence Butler; Sound Effects by Jack Whitney,,,The Thief of Bagdad,,,,,,,,,,
1956 (29th),FILM EDITING,"Gene Ruggiero, Paul Weatherwax",,,Around the World in 80 Days,,,,,,,,,,
1952 (25th),BEST MOTION PICTURE,"Cecil B. DeMille, Producer",,,The Greatest Show on Earth,,,,,,,,,,
1974 (47th),ACTOR,Art Carney,,,Harry and Tonto,"{""Harry""}",,,,,,,,,
1956 (29th),DOCUMENTARY (Feature),"Jacques-Yves Cousteau, Producer",,,The Silent World,,,,,,,,,,
1937 (10th),SHORT SUBJECT (Two-reel),Metro-Goldwyn-Mayer,,,Torture Money,,,,,,,,,,
1977 (50th),DOCUMENTARY (Feature),"John Korty, Dan McCann and Warren L. Lockhart, Producers",,,Who Are the DeBolts? And Where Did They Get Nineteen Kids?,,,,,,,,,,
1967 (40th),COSTUME DESIGN,John Truscott,,,Camelot,,,,,,,,,,
1981 (54th),GORDON E. SAWYER AWARD,,,,,,,,,,,,Joseph B. Walker,,
1949 (22nd),SHORT SUBJECT (One-reel),"Jack Eaton, Producer",,,Aquatic House-Party,,,,,,,,,,
1949 (22nd),ACTOR,Broderick Crawford,,,All the King's Men,"{""Willie Stark""}",,,,,,,,,
1971 (44th),SPECIAL VISUAL EFFECTS,"Alan Maley, Eustace Lycett, Danny Lee",,,Bedknobs and Broomsticks,,,,,,,,,,
1975 (48th),ART DIRECTION,"Art Direction:  Ken Adam, Roy Walker;  Set Decoration:  Vernon Dixon",,,Barry Lyndon,,,,,,,,,,
2022 (95th),JEAN HERSHOLT HUMANITARIAN AWARD,Michael J. Fox,,,,,,,,,,,,,
2006 (79th),GORDON E. SAWYER AWARD,,,,,,,,,,,,Ray Feeney,,
1966 (39th),ACTOR IN A SUPPORTING ROLE,Walter Matthau,,,The Fortune Cookie,"{""Willie Gingrich""}",,,,,,,,,
1953 (26th),SPECIAL EFFECTS,Paramount Studio,,,The War of the Worlds,,,,,,,,,,
1937 (10th),WRITING (Screenplay),"Norman Reilly Raine, Heinz Herald, Geza Herczeg",,,The Life of Emile Zola,,,,,,,,,,
1929/30 (3rd),ACTRESS,Norma Shearer,,,The Divorcee,"{""Jerry""}",,,,,,,,,"[NOTE: As allowed by the award rules for this year, a single nomination could honor work in one or more films.  Though the final awards ballot listed both The Divorcee and Their Own Desire in her nomination, the award was announced for only the The Divorcee performance.  It has never been established as to why this was, but it possibly could have been because the original report from the Acting Branch Board of Judges only listed The Divorcee performance in the results of the nominations voting, or it could have been because on some of the final ballots, the voters had indicated the The Divorcee performance over the other.]"
1965 (38th),SHORT SUBJECT (Live Action),"Claude Berri, Producer",,,The Chicken (Le Poulet),,,,,,,,,,
1999 (72nd),FILM EDITING,Zach Staenberg,,,The Matrix,,,,,,,,,,
2012 (85th),ANIMATED FEATURE FILM,Mark Andrews and Brenda Chapman,,,Brave,,,,,,,,,,
1988 (61st),SPECIAL ACHIEVEMENT AWARD,,,,,,,,,,,,To Richard Williams for the animation direction of Who Framed Roger Rabbit.,,
2007 (80th),JOHN A. BONNER MEDAL OF COMMENDATION,,,,,,,,,,,,To David Inglish in appreciation for outstanding service and dedication in upholding the high standards of the Academy of Motion Picture Arts and Sciences.,,
1940 (13th),SCIENTIFIC OR TECHNICAL AWARD (Class I),,,,,,,,,,,,"To 20TH CENTURY-FOX FILM CORP. for the design and construction of the 20th Century Silenced Camera, developed by DANIEL CLARK, GROVER LAUBE, CHARLES MILLER and ROBERT W. STEVENS.",,
2001 (74th),SCIENTIFIC AND TECHNICAL AWARD (Technical Achievement Award),,,,,,,,,,,,"To PETE ROMANO for the design and development of the Remote AquaCam, an underwater camera housing system for use in motion pictures.","The Remote AquaCam brings to the industry an underwater camera housing specifically designed for remote and high-speed operation.  Its hydro-dynamic shape facilitates ease of operation for surface hand-held filming, and its remote capabilities allow it to film in confined areas or in situations where an operator cannot be near the camera.",
1974 (47th),WRITING (Screenplay Adapted from Other Material),"Francis Ford Coppola, Mario Puzo",,,The Godfather Part II,,,,,,,,,,
2021 (94th),JEAN HERSHOLT HUMANITARIAN AWARD,Danny Glover,,,,,,,,,,,,,
1973 (46th),IRVING G. THALBERG MEMORIAL AWARD,Lawrence Weingarten,,,,,,,,,,,,,
1982 (55th),CINEMATOGRAPHY,"Billy Williams, Ronnie Taylor",,,Gandhi,,,,,,,,,,
1983 (56th),DOCUMENTARY (Short Subject),"Cynthia Scott and Adam Symansky, Producers",,,Flamenco at 5:15,,,,,,,,,,
2005 (78th),ACTRESS IN A LEADING ROLE,Reese Witherspoon,,,Walk the Line,"{""June Carter""}",,,,,,,,,
2016 (89th),DOCUMENTARY (Short Subject),Orlando von Einsiedel and Joanna Natasegara,,,The White Helmets,,,,,,,,,,
1941 (14th),MUSIC (Song),Music by Jerome Kern; Lyrics by Oscar Hammerstein II,,,Lady Be Good,,,,,,,,,,
1969 (42nd),MUSIC (Original Score--for a motion picture [not a musical]),Burt Bacharach,,,Butch Cassidy and the Sundance Kid,,,,,,,,,,
1969 (42nd),DOCUMENTARY (Feature),"Bernard Chevry, Producer",,,Arthur Rubinstein - The Love of Life,,,,,,,,,,
1948 (21st),ACTRESS,Jane Wyman,,,Johnny Belinda,"{""Belinda McDonald""}",,,,,,,,,
1994 (67th),SHORT FILM (Live Action),"Peter Capaldi, Ruth Kenley-Letts","Peggy Rajski, Randy Stone",,Franz Kafka's It's a Wonderful Life,,Trevor,,,,,,,,[NOTE: A tie.  The other winning film in this category was Trevor.]
1982 (55th),VISUAL EFFECTS,"Carlo Rambaldi, Dennis Muren, Kenneth F. Smith",,,E.T. The Extra-Terrestrial,,,,,,,,,,
1954 (27th),SCIENTIFIC OR TECHNICAL AWARD (Class I),,,,,,,,,,,,"To PARAMOUNT PICTURES, INC., LOREN L. RYDER, JOHN R. BISHOP and all the members of the technical and engineering staff for developing a method of producing and exhibiting motion pictures known as VistaVision.",,
1993 (66th),DIRECTING,Steven Spielberg,,,Schindler's List,,,,,,,,,,
1995 (68th),DIRECTING,Mel Gibson,,,Braveheart,,,,,,,,,,
1970 (43rd),CINEMATOGRAPHY,Freddie Young,,,Ryan's Daughter,,,,,,,,,,
1942 (15th),IRVING G. THALBERG MEMORIAL AWARD,Sidney Franklin,,,,,,,,,,,,,
1954 (27th),CINEMATOGRAPHY (Black-and-White),Boris Kaufman,,,On the Waterfront,,,,,,,,,,
1978 (51st),SHORT FILM (Live Action),"Taylor Hackford, Producer",,,Teenage Father,,,,,,,,,,
1927/28 (1st),WRITING (Title Writing),Joseph Farnham,,,,,,,,,,,,,[NOTE: This award was not associated with any specific film title.]
1950 (23rd),CINEMATOGRAPHY (Color),Robert Surtees,,,King Solomon's Mines,,,,,,,,,,
1955 (28th),CINEMATOGRAPHY (Black-and-White),James Wong Howe,,,The Rose Tattoo,,,,,,,,,,
2012 (85th),FILM EDITING,William Goldenberg,,,Argo,,,,,,,,,,
1963 (36th),DIRECTING,Tony Richardson,,,Tom Jones,,,,,,,,,,
1987 (60th),SCIENTIFIC OR TECHNICAL AWARD (Scientific and Engineering Award),,,,,,,,,,,,To WILLI BURTH and KINOTONE CORPORATION for the invention and development of the Non-rewind Platter System for motion picture presentations.,,
1952 (25th),ACTOR IN A SUPPORTING ROLE,Anthony Quinn,,,Viva Zapata!,"{""Eufemio Zapata""}",,,,,,,,,
1981 (54th),DOCUMENTARY (Short Subject),"Nigel Noble, Producer",,,Close Harmony,,,,,,,,,,
1957 (30th),ACTRESS,Joanne Woodward,,,The Three Faces of Eve,"{""Eve White/Eve Black/Jane""}",,,,,,,,,
1944 (17th),ACTOR IN A SUPPORTING ROLE,Barry Fitzgerald,,,Going My Way,"{""Father Fitzgibbon""}",,,,,,,,,
1982 (55th),FILM EDITING,John Bloom,,,Gandhi,,,,,,,,,,
1955 (28th),ART DIRECTION (Color),"Art Direction:  William Flannery, Jo Mielziner;  Set Decoration:  Robert Priestley",,,Picnic,,,,,,,,,,
1958 (31st),ACTOR IN A SUPPORTING ROLE,Burl Ives,,,The Big Country,"{""Rufus Hannassey""}",,,,,,,,,
1969 (42nd),MUSIC (Song--Original for the Picture),Music by Burt Bacharach; Lyrics by Hal David,,,Butch Cassidy and the Sundance Kid,,,,,,,,,,
1948 (21st),DIRECTING,John Huston,,,The Treasure of the Sierra Madre,,,,,,,,,,
1956 (29th),FOREIGN LANGUAGE FILM,"Italy; Dino De Laurentiis and Carlo Ponti, Producers",,,La Strada,,,,,,,,,,"[NOTE: For the 29th Academy Awards, the name(s) of the producer(s) were included in the nomination for the Foreign Language Film category.]"
2001 (74th),SHORT FILM (Animated),Ralph Eggleston,,,For the Birds,,,,,,,,,,
2021 (94th),WRITING (Original Screenplay),Written by Kenneth Branagh,,,Belfast,,,,,,,,,,
1937 (10th),ART DIRECTION,Stephen Goosson,,,Lost Horizon,,,,,,,,,,
2003 (76th),ART DIRECTION,Art Direction: Grant Major; Set Decoration: Dan Hennah and Alan Lee,,,The Lord of the Rings: The Return of the King,,,,,,,,,,
1967 (40th),SCIENTIFIC OR TECHNICAL AWARD (Class III),,,,,,,,,,,,To the ELECTRO-OPTICAL DIVISION OF THE KOLLMORGEN CORPORATION for the design and development of a series of Motion Picture Projection Lenses.,,
1984 (57th),MUSIC (Original Song Score),Prince,,,Purple Rain,,,,,,,,,,
1996 (69th),WRITING (Screenplay Written Directly for the Screen),"Ethan Coen, Joel Coen",,,Fargo,,,,,,,,,,
1951 (24th),DOCUMENTARY (Feature),"Olle Nordemar, Producer",,,Kon-Tiki,,,,,,,,,,
1954 (27th),ACTRESS IN A SUPPORTING ROLE,Eva Marie Saint,,,On the Waterfront,"{""Edie Doyle""}",,,,,,,,,
2022 (95th),SHORT FILM (Animated),Charlie Mackesy and Matthew Freud,,,"The Boy, the Mole, the Fox and the Horse",,,,,,,,,,
1971 (44th),ACTOR IN A SUPPORTING ROLE,Ben Johnson,,,The Last Picture Show,"{""Sam the Lion""}",,,,,,,,,
1999 (72nd),JOHN A. BONNER MEDAL OF COMMENDATION,,,,,,,,,,,,To Edmund M. Di Giulio in appreciation for outstanding service and dedication in upholding the high standards of the Academy of Motion Picture Arts and Sciences.,,
1987 (60th),WRITING (Screenplay Based on Material from Another Medium),"Mark Peploe, Bernardo Bertolucci",,,The Last Emperor,,,,,,,,,,
1943 (16th),DOCUMENTARY (Feature),British Ministry of Information,,,Desert Victory,,,,,,,,,,
2011 (84th),SCIENTIFIC AND TECHNICAL AWARD (Academy Award of Merit),,,,,,,,,,,,"To FRANZ KRAUS, JOHANNES STEURER and WOLFGANG RIEDEL for the design and development of the ARRILASER Film Recorder.","The ARRILASER film recorder demonstrates a high level of engineering resulting in a compact, user-friendly, low-maintenance device, while at the same time maintaining outstanding speed, exposure ratings and image quality.",
1996 (69th),SCIENTIFIC AND TECHNICAL AWARD (Scientific and Engineering Award),,,,,,,,,,,,"To JOHN SCHLAG, BRIAN KNEP, ZORAN KACIC-ALESIC and THOMAS WILLIAMS for the development of the Viewpaint 3D Paint System for film production work.",,
1948 (21st),SHORT SUBJECT (Cartoon),"Fred Quimby, Producer",,,The Little Orphan,,,,,,,,,,
1942 (15th),MUSIC (Scoring of a Musical Picture),"Ray Heindorf, Heinz Roemheld",,,Yankee Doodle Dandy,,,,,,,,,,
1945 (18th),SHORT SUBJECT (Two-reel),"Gordon Hollingshead, Producer",,,Star in the Night,,,,,,,,,,
2022 (95th),DOCUMENTARY SHORT FILM,Kartiki Gonsalves and Guneet Monga,,,The Elephant Whisperers,,,,,,,,,,
1944 (17th),SOUND RECORDING,"20th Century-Fox Studio Sound Department, E. H. Hansen, Sound Director",,,Wilson,,,,,,,,,,
1984 (57th),COSTUME DESIGN,Theodor Pistek,,,Amadeus,,,,,,,,,,
1956 (29th),ACTRESS,Ingrid Bergman,,,Anastasia,"{""The Woman""}",,,,,,,,,
2020 (93rd),SHORT FILM (Animated),Will McCormack and Michael Govier,,,If Anything Happens I Love You,,,,,,,,,,
2001 (74th),VISUAL EFFECTS,"Jim Rygiel, Randall William Cook, Richard Taylor, Mark Stetson",,,The Lord of the Rings: The Fellowship of the Ring,,,,,,,,,,
1946 (19th),CINEMATOGRAPHY (Color),"Charles Rosher, Leonard Smith, Arthur Arling",,,The Yearling,,,,,,,,,,
1991 (64th),CINEMATOGRAPHY,Robert Richardson,,,JFK,,,,,,,,,,
1988 (61st),DOCUMENTARY (Short Subject),"William Guttentag and Malcolm Clarke, Producers",,,You Don't Have to Die,,,,,,,,,,
1939 (12th),MUSIC (Original Score),Herbert Stothart,,,The Wizard of Oz,,,,,,,,,,
1988 (61st),MUSIC (Original Song),Music and Lyric by Carly Simon,,,Working Girl,,,,,,,,,,
1950 (23rd),COSTUME DESIGN (Color),"Edith Head, Dorothy Jeakins, Elois Jenssen, Gile Steele, Gwen Wakeling",,,Samson and Delilah,,,,,,,,,,
1962 (35th),ACTOR,Gregory Peck,,,To Kill a Mockingbird,"{""Atticus Finch""}",,,,,,,,,
2009 (82nd),SHORT FILM (Live Action),Joachim Back and Tivi Magnusson,,,The New Tenants,,,,,,,,,,
1968 (41st),JEAN HERSHOLT HUMANITARIAN AWARD,Martha Raye,,,,,,,,,,,,,
1962 (35th),SPECIAL EFFECTS,Visual Effects by Robert MacDonald; Audible Effects by Jacques Maumont,,,The Longest Day,,,,,,,,,,
1948 (21st),IRVING G. THALBERG MEMORIAL AWARD,Jerry Wald,,,,,,,,,,,,,
2011 (84th),CINEMATOGRAPHY,Robert Richardson,,,Hugo,,,,,,,,,,
2020 (93rd),DOCUMENTARY (Feature),"Pippa Ehrlich, James Reed and Craig Foster",,,My Octopus Teacher,,,,,,,,,,
2003 (76th),ACTOR IN A SUPPORTING ROLE,Tim Robbins,,,Mystic River,"{""Dave Boyle""}",,,,,,,,,
1949 (22nd),DIRECTING,Joseph L. Mankiewicz,,,A Letter to Three Wives,,,,,,,,,,
1999 (72nd),COSTUME DESIGN,Lindy Hemming,,,Topsy-Turvy,,,,,,,,,,
1999 (72nd),SCIENTIFIC AND TECHNICAL AWARD (Technical Achievement Award),,,,,,,,,,,,To VIVIENNE DYER and CHRIS WOOLF for the design and development of the Rycote Microphone Windshield Modular System.,"Designed to eliminate physical acoustical rumble and to mask a microphone's high sensitivity to wind and other unwanted noises, the lightweight and rugged Rycote Microphone Windshields accomplish these tasks without altering or impairing the original frequency response of the microphone.",
2000 (73rd),SCIENTIFIC AND TECHNICAL AWARD (Scientific and Engineering Award),,,,,,,,,,,,"To AL MAYER, SR. and AL MAYER, JR., for the mechanical design, IAIN NEIL for the optical design and BRIAN DANG for the electronic design of the Panavision Millennium XL Camera System.",This camera brings the full uncompromised performance of larger heavy-duty cameras to the lightest weight category with ruggedness and advanced features previously expected only in specialized or effects cameras.,
1993 (66th),FILM EDITING,Michael Kahn,,,Schindler's List,,,,,,,,,,
1979 (52nd),DIRECTING,Robert Benton,,,Kramer vs. Kramer,,,,,,,,,,
1993 (66th),BEST PICTURE,"Steven Spielberg, Gerald R. Molen and Branko Lustig, Producers",,,Schindler's List,,,,,,,,,,
1982 (55th),MUSIC (Original Score),John Williams,,,E.T. The Extra-Terrestrial,,,,,,,,,,
1936 (9th),SOUND RECORDING,"Metro-Goldwyn-Mayer Studio Sound Department, Douglas Shearer, Sound Director",,,San Francisco,,,,,,,,,,
1980 (53rd),FOREIGN LANGUAGE FILM,Union of Soviet Socialist Republics,,,Moscow Does Not Believe in Tears,,,,,,,,,,
1987 (60th),SCIENTIFIC OR TECHNICAL AWARD (Technical Achievement Award),,,,,,,,,,,,"To IOAN ALLEN of Dolby Laboratories, Inc., for the Cat. 43 playback-only noise reduction unit and its practical application to motion picture sound recordings.",,
2018 (91st),CINEMATOGRAPHY,Alfonso Cuarón,,,Roma,,,,,,,,,,
1956 (29th),CINEMATOGRAPHY (Color),Lionel Lindon,,,Around the World in 80 Days,,,,,,,,,,
2022 (95th),VISUAL EFFECTS,"Joe Letteri, Richard Baneham, Eric Saindon and Daniel Barrett",,,Avatar: The Way of Water,,,,,,,,,,
1993 (66th),SOUND EFFECTS EDITING,"Gary Rydstrom, Richard Hymns",,,Jurassic Park,,,,,,,,,,
