award_year,category,name1,name2,name3,film_title,character_name,film_title2,character_name2,film_title3,character_name3,film_title4,character_name4,honorary_statement,description,note
1949 (22nd),SCIENTIFIC OR TECHNICAL AWARD (Class I),,,,,,,,,,,,To EASTMAN KODAK COMPANY for the development and introduction of an improved safety base motion picture film.,,
1984 (57th),BEST PICTURE,"Saul Zaentz, Producer",,,Amadeus,,,,,,,,,,
1953 (26th),DOCUMENTARY (Short Subject),"Walt Disney, Producer",,,The Alaskan Eskimo,,,,,,,,,,
2019 (92nd),FILM EDITING,Michael McCusker and Andrew Buckland,,,Ford v Ferrari,,,,,,,,,,
2018 (91st),SHORT FILM (Animated),Domee Shi and Becky Neiman-Cobb,,,Bao,,,,,,,,,,
2022 (95th),SCIENTIFIC AND TECHNICAL AWARD (Technical Achievement Award),,,,,,,,,,,,"To HOWARD JENSEN and DANNY CANGEMI for the concept and creation, and to JOHN FRAZIER for the development of the 60- and 100-foot Rain Bars.","The Rain Bars provide a portable system for the creation of realistic, large-scale, adjustable, practical rain for motion pictures. Their rapid setup and relocation capabilities enable the efficient production of effects ranging from misting drizzles to torrential downpours.",
1948 (21st),FILM EDITING,Paul Weatherwax,,,The Naked City,,,,,,,,,,
1985 (58th),DOCUMENTARY (Short Subject),"David Goodman, Producer",,,Witness to War: Dr. Charlie Clements,,,,,,,,,,
2017 (90th),DOCUMENTARY (Short Subject),Frank Stiefel,,,Heaven Is a Traffic Jam on the 405,,,,,,,,,,
1961 (34th),FOREIGN LANGUAGE FILM,Sweden,,,Through a Glass Darkly,,,,,,,,,,
1959 (32nd),ART DIRECTION (Color),"Art Direction:  William A. Horning, Edward Carfagno;  Set Decoration:  Hugh Hunt",,,Ben-Hur,,,,,,,,,,
2005 (78th),GORDON E. SAWYER AWARD,,,,,,,,,,,,Gary Demos,,
1959 (32nd),CINEMATOGRAPHY (Color),Robert L. Surtees,,,Ben-Hur,,,,,,,,,,
1977 (50th),CINEMATOGRAPHY,Vilmos Zsigmond,,,Close Encounters of the Third Kind,,,,,,,,,,
2006 (79th),FILM EDITING,Thelma Schoonmaker,,,The Departed,,,,,,,,,,
1972 (45th),SHORT SUBJECT (Animated),"Richard Williams, Producer",,,A Christmas Carol,,,,,,,,,,
1969 (42nd),DIRECTING,John Schlesinger,,,Midnight Cowboy,,,,,,,,,,
1929/30 (3rd),CINEMATOGRAPHY,"Joseph T. Rucker, Willard Van Der Veer",,,With Byrd at the South Pole,,,,,,,,,,
1939 (12th),MUSIC (Song),Music by Harold Arlen; Lyrics by E. Y. Harburg,,,The Wizard of Oz,,,,,,,,,,
2001 (74th),MUSIC (Original Song),Music and Lyric by Randy Newman,,,"Monsters, Inc.",,,,,,,,,,
1955 (28th),CINEMATOGRAPHY (Color),Robert Burks,,,To Catch a Thief,,,,,,,,,,
1991 (64th),SHORT FILM (Live Action),"Seth Winston, Rob Fried",,,Session Man,,,,,,,,,,
2007 (80th),FOREIGN LANGUAGE FILM,Austria,,,The Counterfeiters,,,,,,,,,,
1958 (31st),IRVING G. THALBERG MEMORIAL AWARD,Jack L. Warner,,,,,,,,,,,,,
2009 (82nd),SOUND EDITING,Paul N.J. Ottosson,,,The Hurt Locker,,,,,,,,,,
1937 (10th),ASSISTANT DIRECTOR,Robert Webb,,,In Old Chicago,,,,,,,,,,
1965 (38th),ACTRESS,Julie Christie,,,Darling,"{""Diana Scott""}",,,,,,,,,
1983 (56th),SCIENTIFIC OR TECHNICAL AWARD (Academy Award of Merit),,,,,,,,,,,,To DR. KURT LARCHE of OSRAM GmbH for the research and development of xenon short-arc discharge lamps for motion picture projection.,,
2009 (82nd),IRVING G. THALBERG MEMORIAL AWARD,John Calley,,,,,,,,,,,,,
2002 (75th),ACTRESS IN A LEADING ROLE,Nicole Kidman,,,The Hours,"{""Virginia Woolf""}",,,,,,,,,
1969 (42nd),SHORT SUBJECT (Cartoon),"Ward Kimball, Producer",,,It's Tough to Be a Bird,,,,,,,,,,
1992 (65th),AWARD OF COMMENDATION,,,,,,,,,,,,"To The International Alliance of Theatrical Stage Employees in recognition of the indispensable contributions of its members, who represent the full spectrum of artists, technicians and craftspeople, to the art of motion pictures on the occasion of the one-hundredth anniversary of the Alliance's founding.",,
2014 (87th),WRITING (Original Screenplay),"Written by Alejandro G. Iñárritu, Nicolás Giacobone, Alexander Dinelaris, Jr. & Armando Bo",,,Birdman or (The Unexpected Virtue of Ignorance),,,,,,,,,,
1979 (52nd),WRITING (Screenplay Written Directly for the Screen),Steve Tesich,,,Breaking Away,,,,,,,,,,
1949 (22nd),ART DIRECTION (Black-and-White),"Art Direction:  Harry Horner, John Meehan;  Set Decoration:  Emile Kuri",,,The Heiress,,,,,,,,,,
1947 (20th),DOCUMENTARY (Feature),"Sid Rogell, Executive Producer;  Theron Warth and Richard O. Fleischer, Producers",,,Design for Death,,,,,,,,,,
1951 (24th),ACTOR IN A SUPPORTING ROLE,Karl Malden,,,A Streetcar Named Desire,"{""Mitch""}",,,,,,,,,
2018 (91st),ACTRESS IN A LEADING ROLE,Olivia Colman,,,The Favourite,"{""Queen Anne""}",,,,,,,,,
1939 (12th),OUTSTANDING PRODUCTION,Selznick International Pictures,,,Gone with the Wind,,,,,,,,,,
1978 (51st),SCIENTIFIC OR TECHNICAL AWARD (Scientific and Engineering Award),,,,,,,,,,,,"To RAY M. DOLBY, IOAN R. ALLEN, DAVID P. ROBINSON, STEPHEN M. KATZ and PHILIP S. J. BOOLE of Dolby Laboratories, Incorporated, for the development and implementation of an improved Sound Recording and Reproducing System for Motion Picture Production and Exhibition.",,
1956 (29th),IRVING G. THALBERG MEMORIAL AWARD,Buddy Adler,,,,,,,,,,,,,
1978 (51st),MUSIC (Original Song),Music and Lyrics by Paul Jabara,,,Thank God It's Friday,,,,,,,,,,
1956 (29th),MUSIC (Scoring of a Musical Picture),"Alfred Newman, Ken Darby",,,The King and I,,,,,,,,,,
1945 (18th),ART DIRECTION (Black-and-White),Art Direction:  Wiard Ihnen;  Interior Decoration:  A. Roland Fields,,,Blood on the Sun,,,,,,,,,,
1967 (40th),DOCUMENTARY (Feature),"Pierre Schoendoerffer, Producer",,,The Anderson Platoon,,,,,,,,,,
2009 (82nd),ACTOR IN A LEADING ROLE,Jeff Bridges,,,Crazy Heart,"{""Bad Blake""}",,,,,,,,,
2005 (78th),BEST PICTURE,"Paul Haggis and Cathy Schulman, Producers",,,Crash,,,,,,,,,,
2012 (85th),PRODUCTION DESIGN,Production Design: Rick Carter; Set Decoration: Jim Erickson,,,Lincoln,,,,,,,,,,
1944 (17th),ACTOR,Bing Crosby,,,Going My Way,"{""Father O'Malley""}",,,,,,,,,
1985 (58th),DOCUMENTARY (Feature),"Maria Florio and Victoria Mudd, Producers",,,Broken Rainbow,,,,,,,,,,
1981 (54th),HONORARY AWARD,,,,,,,,,,,,To Barbara Stanwyck for superlative creativity and unique contribution to the art of screen acting.,,
1948 (21st),COSTUME DESIGN (Black-and-White),Roger K. Furse,,,Hamlet,,,,,,,,,,
1991 (64th),WRITING (Screenplay Based on Material Previously Produced or Published),Ted Tally,,,The Silence of the Lambs,,,,,,,,,,
1990 (63rd),DOCUMENTARY (Feature),"Barbara Kopple and Arthur Cohn, Producers",,,American Dream,,,,,,,,,,
1980 (53rd),ACTOR IN A LEADING ROLE,Robert De Niro,,,Raging Bull,"{""Jake LaMotta""}",,,,,,,,,
2013 (86th),MUSIC (Original Song),Music and Lyric by Kristen Anderson-Lopez and Robert Lopez,,,Frozen,,,,,,,,,,
1944 (17th),WRITING (Original Motion Picture Story),Leo McCarey,,,Going My Way,,,,,,,,,,
1990 (63rd),FOREIGN LANGUAGE FILM,Switzerland,,,Journey of Hope,,,,,,,,,,
1946 (19th),WRITING (Original Motion Picture Story),Clemence Dane,,,Vacation from Marriage,,,,,,,,,,
1974 (47th),ACTRESS,Ellen Burstyn,,,Alice Doesn't Live Here Anymore,"{""Alice Hyatt""}",,,,,,,,,
2015 (88th),FILM EDITING,Margaret Sixel,,,Mad Max: Fury Road,,,,,,,,,,
1948 (21st),CINEMATOGRAPHY (Black-and-White),William Daniels,,,The Naked City,,,,,,,,,,
1936 (9th),SPECIAL AWARD,,,,,,,,,,,,To The March of Time for its significance to motion pictures and for having revolutionized one of the most important branches of the industry - the newsreel.,,
1949 (22nd),SOUND RECORDING,"20th Century-Fox Studio Sound Department, Thomas T. Moulton, Sound Director",,,Twelve O'Clock High,,,,,,,,,,
1989 (62nd),FILM EDITING,"David Brenner, Joe Hutshing",,,Born on the Fourth of July,,,,,,,,,,
1957 (30th),HONORARY AWARD,,,,,,,,,,,,To Charles Brackett for outstanding service to the Academy.,,
1976 (49th),SPECIAL ACHIEVEMENT AWARD (Visual Effects),"Carlo Rambaldi, Glen Robinson, Frank Van der Veer","L. B. Abbott, Glen Robinson, Matthew Yuricich",,King Kong,,Logan's Run,,,,,,,,
1999 (72nd),MUSIC (Original Song),Music and Lyric by Phil Collins,,,Tarzan,,,,,,,,,,
2016 (89th),MAKEUP AND HAIRSTYLING,"Alessandro Bertolazzi, Giorgio Gregorini and Christopher Nelson",,,Suicide Squad,,,,,,,,,,
1956 (29th),JEAN HERSHOLT HUMANITARIAN AWARD,Y. Frank Freeman,,,,,,,,,,,,,
1956 (29th),SHORT SUBJECT (One-reel),"Konstantin Kalser, Producer",,,Crashing the Water Barrier,,,,,,,,,,
1952 (25th),SOUND RECORDING,London Film Sound Department,,,Breaking the Sound Barrier,,,,,,,,,,
1994 (67th),COSTUME DESIGN,"Lizzy Gardiner, Tim Chappel",,,"The Adventures of Priscilla, Queen of the Desert",,,,,,,,,,
1964 (37th),CINEMATOGRAPHY (Color),Harry Stradling,,,My Fair Lady,,,,,,,,,,
1996 (69th),CINEMATOGRAPHY,John Seale,,,The English Patient,,,,,,,,,,
1943 (16th),ACTRESS,Jennifer Jones,,,The Song of Bernadette,"{""Bernadette Soubirous""}",,,,,,,,,
1964 (37th),COSTUME DESIGN (Black-and-White),Dorothy Jeakins,,,The Night of the Iguana,,,,,,,,,,
1975 (48th),ACTRESS,Louise Fletcher,,,One Flew over the Cuckoo's Nest,"{""Nurse Mildred Ratched""}",,,,,,,,,
1966 (39th),CINEMATOGRAPHY (Color),Ted Moore,,,A Man for All Seasons,,,,,,,,,,
2000 (73rd),SOUND,"Scott Millan, Bob Beemer, Ken Weston",,,Gladiator,,,,,,,,,,
1986 (59th),SHORT FILM (Live Action),"Chuck Workman, Producer",,,Precious Images,,,,,,,,,,
1997 (70th),ART DIRECTION,Art Direction:  Peter Lamont;  Set Decoration:  Michael Ford,,,Titanic,,,,,,,,,,
1951 (24th),IRVING G. THALBERG MEMORIAL AWARD,Arthur Freed,,,,,,,,,,,,,
1968 (41st),ACTRESS IN A SUPPORTING ROLE,Ruth Gordon,,,Rosemary's Baby,"{""Minnie Castevet""}",,,,,,,,,
2019 (92nd),VISUAL EFFECTS,"Guillaume Rocheron, Greg Butler and Dominic Tuohy",,,1917,,,,,,,,,,
2017 (90th),ANIMATED FEATURE FILM,Lee Unkrich and Darla K. Anderson,,,Coco,,,,,,,,,,
1938 (11th),MUSIC (Song),Music by Ralph Rainger; Lyrics by Leo Robin,,,The Big Broadcast of 1938,,,,,,,,,,
2010 (83rd),DOCUMENTARY (Short Subject),Karen Goodman and Kirk Simon,,,Strangers No More,,,,,,,,,,
1965 (38th),COSTUME DESIGN (Color),Phyllis Dalton,,,Doctor Zhivago,,,,,,,,,,
1966 (39th),WRITING (Story and Screenplay--written directly for the screen),"Story by Claude Lelouch;  Screenplay by Claude Lelouch, Pierre Uytterhoeven",,,A Man and a Woman,,,,,,,,,,
1993 (66th),SHORT FILM (Animated),Nick Park,,,The Wrong Trousers,,,,,,,,,,
2018 (91st),SCIENTIFIC AND TECHNICAL AWARD (Technical Achievement Award),,,,,,,,,,,,"To ERIC DACHS, ERIK BIELEFELDT, CRAIG WOOD and PAUL McREYNOLDS for the design and development of the PIX System's novel security mechanism for distributing media.",PIX System's robust approach to secure media access has enabled wide adoption of their remotely collaborative dailies-review system by the motion picture industry.,
1946 (19th),CINEMATOGRAPHY (Color),"Charles Rosher, Leonard Smith, Arthur Arling",,,The Yearling,,,,,,,,,,
1941 (14th),SCIENTIFIC OR TECHNICAL AWARD (Class II),,,,,,,,,,,,"To ELECTRICAL RESEARCH PRODUCTS DIVISION OF WESTERN ELECTRIC CO., INC., for the development of the precision integrating sphere densitometer.",,
1991 (64th),SHORT FILM (Animated),Daniel Greaves,,,Manipulation,,,,,,,,,,
2004 (77th),VISUAL EFFECTS,"John Dykstra, Scott Stokdyk, Anthony LaMolinara and John Frazier",,,Spider-Man 2,,,,,,,,,,
1942 (15th),SCIENTIFIC OR TECHNICAL AWARD (Class III),,,,,,,,,,,,To ROBERT HENDERSON and the PARAMOUNT STUDIO ENGINEERING and TRANSPARENCY DEPARTMENTS for the design and construction of adjustable light bridges and screen frames for transparency process photography.,,
1988 (61st),WRITING (Screenplay Written Directly for the Screen),"Screenplay by Ronald Bass, Barry Morrow;  Story by Barry Morrow",,,Rain Man,,,,,,,,,,
1983 (56th),SCIENTIFIC OR TECHNICAL AWARD (Technical Achievement Award),,,,,,,,,,,,"To WILLIAM G. KROKAUGGER of Mole-Richardson Company for the design and engineering of a portable, 12,000 watt, lighting-control dimmer for use in motion picture production.",,
2020 (93rd),MAKEUP AND HAIRSTYLING,"Sergio Lopez-Rivera, Mia Neal and Jamika Wilson",,,Ma Rainey's Black Bottom,,,,,,,,,,
1991 (64th),IRVING G. THALBERG MEMORIAL AWARD,George Lucas,,,,,,,,,,,,,
1969 (42nd),ACTOR,John Wayne,,,True Grit,"{""Rooster Cogburn""}",,,,,,,,,
2012 (85th),FOREIGN LANGUAGE FILM,Austria,,,Amour,,,,,,,,,,
1954 (27th),SPECIAL EFFECTS,Walt Disney Studios,,,"20,000 Leagues under the Sea",,,,,,,,,,
2010 (83rd),HONORARY AWARD,,,,,,,,,,,,To Kevin Brownlow for the wise and devoted chronicling of the cinematic parade.,,
2010 (83rd),JOHN A. BONNER MEDAL OF COMMENDATION,,,,,,,,,,,,To Denny Clairmont in appreciation for outstanding service and dedication in upholding the high standards of the Academy of Motion Picture Arts and Sciences.,,
1976 (49th),SHORT FILM (Live Action),"Andre Guttfreund and Peter Werner, Producers",,,In the Region of Ice,,,,,,,,,,
1981 (54th),CINEMATOGRAPHY,Vittorio Storaro,,,Reds,,,,,,,,,,
2002 (75th),FOREIGN LANGUAGE FILM,Germany,,,Nowhere in Africa,,,,,,,,,,
1967 (40th),SHORT SUBJECT (Live Action),"Christopher Chapman, Producer",,,A Place to Stand,,,,,,,,,,
1973 (46th),SHORT SUBJECT (Live Action),"Allan Miller and William Fertik, Producers",,,The Bolero,,,,,,,,,,
2021 (94th),SHORT FILM (Live Action),Aneil Karia and Riz Ahmed,,,The Long Goodbye,,,,,,,,,,
2019 (92nd),ACTRESS IN A SUPPORTING ROLE,Laura Dern,,,Marriage Story,"{""Nora Fanshaw""}",,,,,,,,,
1950 (23rd),DOCUMENTARY (Short Subject),"Edmund Reek, Producer",,,Why Korea?,,,,,,,,,,
1952 (25th),WRITING (Screenplay),Charles Schnee,,,The Bad and the Beautiful,,,,,,,,,,
1955 (28th),COSTUME DESIGN (Color),Charles LeMaire,,,Love Is a Many-Splendored Thing,,,,,,,,,,
2011 (84th),ACTOR IN A SUPPORTING ROLE,Christopher Plummer,,,Beginners,"{""Hal""}",,,,,,,,,
1983 (56th),JEAN HERSHOLT HUMANITARIAN AWARD,M. J. Frankovich,,,,,,,,,,,,,
1990 (63rd),COSTUME DESIGN,Franca Squarciapino,,,Cyrano de Bergerac,,,,,,,,,,
1954 (27th),WRITING (Motion Picture Story),Philip Yordan,,,Broken Lance,,,,,,,,,,
2001 (74th),CINEMATOGRAPHY,Andrew Lesnie,,,The Lord of the Rings: The Fellowship of the Ring,,,,,,,,,,
1994 (67th),MAKEUP,"Rick Baker, Ve Neill, Yolanda Toussieng",,,Ed Wood,,,,,,,,,,
1949 (22nd),DOCUMENTARY (Short Subject),"Richard de Rochemont, Producer","Edward Selzer, Producer",,A Chance to Live,,So Much for So Little,,,,,,,,[NOTE: A tie.  The other winning film in this category was So Much for So Little.]
1985 (58th),SHORT FILM (Live Action),"Jeff Brown and Chris Pelzer, Producers",,,Molly's Pilgrim,,,,,,,,,,
1968 (41st),SHORT SUBJECT (Live Action),"Charles Guggenheim, Producer",,,Robert Kennedy Remembered,,,,,,,,,,
1975 (48th),BEST PICTURE,"Saul Zaentz and Michael Douglas, Producers",,,One Flew over the Cuckoo's Nest,,,,,,,,,,
1951 (24th),DIRECTING,George Stevens,,,A Place in the Sun,,,,,,,,,,
2015 (88th),MUSIC (Original Song),Music and Lyric by Jimmy Napes and Sam Smith,,,Spectre,,,,,,,,,,
1965 (38th),IRVING G. THALBERG MEMORIAL AWARD,William Wyler,,,,,,,,,,,,,
1963 (36th),MUSIC (Music Score--substantially original),John Addison,,,Tom Jones,,,,,,,,,,
1981 (54th),VISUAL EFFECTS,"Richard Edlund, Kit West, Bruce Nicholson, Joe Johnston",,,Raiders of the Lost Ark,,,,,,,,,,
1980 (53rd),MUSIC (Original Score),Michael Gore,,,Fame,,,,,,,,,,
1941 (14th),WRITING (Original Screenplay),"Herman J. Mankiewicz, Orson Welles",,,Citizen Kane,,,,,,,,,,
1945 (18th),CINEMATOGRAPHY (Black-and-White),Harry Stradling,,,The Picture of Dorian Gray,,,,,,,,,,
1975 (48th),WRITING (Screenplay Adapted from Other Material),"Lawrence Hauben, Bo Goldman",,,One Flew over the Cuckoo's Nest,,,,,,,,,,
1952 (25th),IRVING G. THALBERG MEMORIAL AWARD,Cecil B. DeMille,,,,,,,,,,,,,
1953 (26th),MUSIC (Scoring of a Musical Picture),Alfred Newman,,,Call Me Madam,,,,,,,,,,
1973 (46th),SHORT SUBJECT (Animated),"Frank Mouris, Producer",,,Frank Film,,,,,,,,,,
1977 (50th),HONORARY AWARD,,,,,,,,,,,,To Margaret Booth for her exceptional contribution to the art of film editing in the motion picture industry.,,
2010 (83rd),DIRECTING,Tom Hooper,,,The King's Speech,,,,,,,,,,
2019 (92nd),DOCUMENTARY (Feature),"Steven Bognar, Julia Reichert and Jeff Reichert",,,American Factory,,,,,,,,,,
1974 (47th),ACTRESS IN A SUPPORTING ROLE,Ingrid Bergman,,,Murder on the Orient Express,"{""Greta Ohlsson""}",,,,,,,,,
1984 (57th),HONORARY AWARD,,,,,,,,,,,,"To James Stewart, for his fifty years of memorable performances.  For his high ideals both on and off the screen.  With the respect and affection of his colleagues.",,
1951 (24th),SCIENTIFIC OR TECHNICAL AWARD (Class III),,,,,,,,,,,,"To RICHARD M. HAFF, FRANK P. HERRNFELD, GARLAND C. MISENER and the ANSCO FILM DIVISION OF GENERAL ANILINE AND FILM CORPORATION for the development of the Ansco color scene tester.",,
1970 (43rd),SPECIAL VISUAL EFFECTS,"A. D. Flowers, L. B. Abbott",,,Tora! Tora! Tora!,,,,,,,,,,
1987 (60th),SHORT FILM (Animated),"Frédéric Back, Producer",,,The Man Who Planted Trees,,,,,,,,,,
1946 (19th),SCIENTIFIC OR TECHNICAL AWARD (Class III),,,,,,,,,,,,To HARLAN L. BAUMBACH and the PARAMOUNT WEST COAST LABORATORY for an improved method for the quantitative determination of hydroquinone and metol in photographic developing baths.,,
1993 (66th),DOCUMENTARY (Short Subject),"Margaret Lazarus, Renner Wunderlich",,,Defending Our Lives,,,,,,,,,,
1934 (7th),SOUND RECORDING,"Columbia Studio Sound Department, John Livadary, Sound Director",,,One Night of Love,,,,,,,,,,
1991 (64th),FILM EDITING,"Joe Hutshing, Pietro Scalia",,,JFK,,,,,,,,,,
1988 (61st),HONORARY AWARD,,,,,,,,,,,,"To the National Film Board of Canada in recognition of its 50th anniversary and its dedicated commitment to originate artistic, creative and technological activity and excellence in every area of film making.",,
2021 (94th),CINEMATOGRAPHY,Greig Fraser,,,Dune,,,,,,,,,,
1956 (29th),BEST MOTION PICTURE,"Michael Todd, Producer",,,Around the World in 80 Days,,,,,,,,,,
1990 (63rd),MEDAL OF COMMENDATION,,,,,,,,,,,,To Roderick T. Ryan in appreciation for outstanding service and dedication in upholding the high standards of the Academy of Motion Picture Arts and Sciences.,,
1994 (67th),HONORARY AWARD,,,,,,,,,,,,To Michelangelo Antonioni in recognition of his place as one of the cinema's master visual stylists.,,
2019 (92nd),WRITING (Adapted Screenplay),Screenplay by Taika Waititi,,,Jojo Rabbit,,,,,,,,,,
1963 (36th),ACTOR IN A SUPPORTING ROLE,Melvyn Douglas,,,Hud,"{""Homer Bannon""}",,,,,,,,,
1991 (64th),GORDON E. SAWYER AWARD,,,,,,,,,,,,Ray Harryhausen,,
1945 (18th),ACTRESS IN A SUPPORTING ROLE,Anne Revere,,,National Velvet,"{""Mrs. Brown""}",,,,,,,,,
1966 (39th),SOUND EFFECTS,Gordon Daniel,,,Grand Prix,,,,,,,,,,
1958 (31st),SCIENTIFIC OR TECHNICAL AWARD (Class II),,,,,,,,,,,,"To DON W. PRIDEAUX, LEROY G. LEIGHTON and the LAMP DIVISION OF GENERAL ELECTRIC CO. for the development and production of an improved 10 kilowatt lamp for motion picture set lighting.",,
2017 (90th),DOCUMENTARY (Feature),Bryan Fogel and Dan Cogan,,,Icarus,,,,,,,,,,
2011 (84th),SOUND EDITING,Philip Stockton and Eugene Gearty,,,Hugo,,,,,,,,,,
1936 (9th),ACTRESS,Luise Rainer,,,The Great Ziegfeld,"{""Anna Held""}",,,,,,,,,
1976 (49th),MUSIC (Original Score),Jerry Goldsmith,,,The Omen,,,,,,,,,,
1947 (20th),BEST MOTION PICTURE,20th Century-Fox,,,Gentleman's Agreement,,,,,,,,,,
1971 (44th),SCIENTIFIC OR TECHNICAL AWARD (Class III),,,,,,,,,,,,"To THOMAS JEFFERSON HUTCHINSON, JAMES R. ROCHESTER and FENTON HAMILTON for the development and introduction of the Sunbrute system of xenon arc lamps for location lighting in motion picture production.",,
2005 (78th),COSTUME DESIGN,Colleen Atwood,,,Memoirs of a Geisha,,,,,,,,,,
1928/29 (2nd),ACTRESS,Mary Pickford,,,Coquette,"{""Norma Besant""}",,,,,,,,,"[NOTE: THIS IS NOT AN OFFICIAL NOMINATION.  There were no announcements of nominations, no certificates of nomination or honorable mention, and only the winners (*) were revealed during the awards banquet on April 3, 1930.]"
1978 (51st),SCIENTIFIC OR TECHNICAL AWARD (Academy Award of Merit),,,,,,,,,,,,To EASTMAN KODAK COMPANY for the research and development of a Duplicating Color film for Motion Pictures.,,
2016 (89th),SCIENTIFIC AND TECHNICAL AWARD (Technical Achievement Award),,,,,,,,,,,,To THOMSON GRASS VALLEY for the design and engineering of the pioneering Viper FilmStream digital camera system.,"The Viper camera enabled frame-based logarithmic encoding, which provided uncompressed camera output suitable for importing into existing digital intermediate workflows.",
2010 (83rd),FILM EDITING,Angus Wall and Kirk Baxter,,,The Social Network,,,,,,,,,,
2011 (84th),ACTOR IN A LEADING ROLE,Jean Dujardin,,,The Artist,"{""George Valentin""}",,,,,,,,,
1997 (70th),HONORARY AWARD,,,,,,,,,,,,"To Stanley Donen in appreciation of a body of work marked by grace, elegance, wit and visual innovation.",,
1984 (57th),WRITING (Screenplay Based on Material from Another Medium),Peter Shaffer,,,Amadeus,,,,,,,,,,
1937 (10th),SCIENTIFIC OR TECHNICAL AWARD (Class III),,,,,,,,,,,,To JOHN ARNOLD and the METRO-GOLDWYN-MAYER STUDIO CAMERA DEPARTMENT for their improvement of the semi-automatic follow focus device and its application to all of the cameras used by the Metro-Goldwyn-Mayer Studio.,,
2004 (77th),MUSIC (Original Score),Jan A.P. Kaczmarek,,,Finding Neverland,,,,,,,,,,
1966 (39th),CINEMATOGRAPHY (Black-and-White),Haskell Wexler,,,Who's Afraid of Virginia Woolf?,,,,,,,,,,
1953 (26th),ACTOR,William Holden,,,Stalag 17,"{""Sefton""}",,,,,,,,,
1956 (29th),SHORT SUBJECT (Cartoon),"Stephen Bosustow, Producer",,,Mister Magoo's Puddle Jumper,,,,,,,,,,
2004 (77th),DIRECTING,Clint Eastwood,,,Million Dollar Baby,,,,,,,,,,
1950 (23rd),MUSIC (Music Score of a Dramatic or Comedy Picture),Franz Waxman,,,Sunset Blvd.,,,,,,,,,,
1940 (13th),ACTOR,James Stewart,,,The Philadelphia Story,"{""Mike Connor""}",,,,,,,,,
1977 (50th),FILM EDITING,"Paul Hirsch, Marcia Lucas, Richard Chew",,,Star Wars,,,,,,,,,,
2016 (89th),CINEMATOGRAPHY,Linus Sandgren,,,La La Land,,,,,,,,,,
1950 (23rd),MUSIC (Scoring of a Musical Picture),"Adolph Deutsch, Roger Edens",,,Annie Get Your Gun,,,,,,,,,,
1977 (50th),ART DIRECTION,"Art Direction:  John Barry, Norman Reynolds, Leslie Dilley;  Set Decoration:  Roger Christian",,,Star Wars,,,,,,,,,,
2020 (93rd),ANIMATED FEATURE FILM,Pete Docter and Dana Murray,,,Soul,,,,,,,,,,
1947 (20th),WRITING (Screenplay),George Seaton,,,Miracle on 34th Street,,,,,,,,,,
1947 (20th),DOCUMENTARY (Short Subject),United Nations Division of Films and Visual Information,,,First Steps,,,,,,,,,,
1989 (62nd),SHORT FILM (Live Action),James Hendrie,,,Work Experience,,,,,,,,,,
1954 (27th),ACTOR IN A SUPPORTING ROLE,Edmond O'Brien,,,The Barefoot Contessa,"{""Oscar Muldoon""}",,,,,,,,,
1941 (14th),WRITING (Screenplay),"Sidney Buchman, Seton I. Miller",,,Here Comes Mr. Jordan,,,,,,,,,,
1973 (46th),MUSIC (Scoring: Original Song Score and Adaptation -or- Scoring: Adaptation),Adaptation Score by Marvin Hamlisch,,,The Sting,,,,,,,,,,
1956 (29th),HONORARY AWARD,,,,,,,,,,,,To Eddie Cantor for distinguished service to the film industry.,,
2019 (92nd),SOUND EDITING,Donald Sylvester,,,Ford v Ferrari,,,,,,,,,,
1941 (14th),IRVING G. THALBERG MEMORIAL AWARD,Walt Disney,,,,,,,,,,,,,
1968 (41st),SCIENTIFIC OR TECHNICAL AWARD (Class III),,,,,,,,,,,,To CARL W. HAUGE and EDWARD H. REICHARD of Consolidated Film Industries and E. MICHAEL MEAHL and ROY J. RIDENOUR of Ramtronics for engineering an automatic exposure control for printing-machine lamps.,,
2008 (81st),FILM EDITING,Chris Dickens,,,Slumdog Millionaire,,,,,,,,,,
1967 (40th),ACTOR IN A SUPPORTING ROLE,George Kennedy,,,Cool Hand Luke,"{""Dragline""}",,,,,,,,,
1944 (17th),WRITING (Screenplay),"Frank Butler, Frank Cavett",,,Going My Way,,,,,,,,,,
1963 (36th),ACTRESS,Patricia Neal,,,Hud,"{""Alma""}",,,,,,,,,
1945 (18th),MUSIC (Scoring of a Musical Picture),Georgie Stoll,,,Anchors Aweigh,,,,,,,,,,
2018 (91st),DOCUMENTARY (Short Subject),Rayka Zehtabchi and Melissa Berton,,,Period. End of Sentence.,,,,,,,,,,
1947 (20th),FILM EDITING,"Francis Lyon, Robert Parrish",,,Body and Soul,,,,,,,,,,
1928/29 (2nd),WRITING,Hans Kraly,,,The Patriot,,,,,,,,,,"[NOTE: THIS IS NOT AN OFFICIAL NOMINATION.  There were no announcements of nominations, no certificates of nomination or honorable mention, and only the winners (*) were revealed during the awards banquet on April 3, 1930.]"
2007 (80th),WRITING (Adapted Screenplay),Written for the screen by Joel Coen & Ethan Coen,,,No Country for Old Men,,,,,,,,,,
2012 (85th),SHORT FILM (Live Action),Shawn Christensen,,,Curfew,,,,,,,,,,
2020 (93rd),WRITING (Original Screenplay),Written by Emerald Fennell,,,Promising Young Woman,,,,,,,,,,
1973 (46th),BEST PICTURE,"Tony Bill, Michael Phillips and Julia Phillips, Producers",,,The Sting,,,,,,,,,,
1962 (35th),MUSIC (Scoring of Music--adaptation or treatment),Ray Heindorf,,,Meredith Willson's The Music Man,,,,,,,,,,
1998 (71st),BEST PICTURE,"David Parfitt, Donna Gigliotti, Harvey Weinstein, Edward Zwick and Marc Norman, Producers",,,Shakespeare in Love,,,,,,,,,,
1999 (72nd),ACTRESS IN A LEADING ROLE,Hilary Swank,,,Boys Don't Cry,"{""Brandon Teena/Teena Brandon""}",,,,,,,,,
1974 (47th),ART DIRECTION,"Art Direction:  Dean Tavoularis, Angelo Graham;  Set Decoration:  George R. Nelson",,,The Godfather Part II,,,,,,,,,,
1991 (64th),MUSIC (Original Song),Music by Alan Menken; Lyric by Howard Ashman,,,Beauty and the Beast,,,,,,,,,,
1975 (48th),SHORT FILM (Animated),"Bob Godfrey, Producer",,,Great,,,,,,,,,,
2000 (73rd),WRITING (Screenplay Written Directly for the Screen),Written by Cameron Crowe,,,Almost Famous,,,,,,,,,,
2000 (73rd),HONORARY AWARD,,,,,,,,,,,,"To Jack Cardiff, master of light and color.",,
1976 (49th),BEST PICTURE,"Irwin Winkler and Robert Chartoff, Producers",,,Rocky,,,,,,,,,,
1972 (45th),DOCUMENTARY (Feature),"Howard Smith and Sarah Kernochan, Producers",,,Marjoe,,,,,,,,,,
1936 (9th),ASSISTANT DIRECTOR,Jack Sullivan,,,The Charge of the Light Brigade,,,,,,,,,,
2012 (85th),WRITING (Adapted Screenplay),Screenplay by Chris Terrio,,,Argo,,,,,,,,,,
1968 (41st),DIRECTING,Carol Reed,,,Oliver!,,,,,,,,,,
